sent,reference,translation
ドバイのような新しい都市や ローマのような古代都市に建つ ザハ ・ ハディッドの 国立21世紀美術館 そして ここ ニューヨークは ハイラインの開発によって 大いに影響を受けました,"I think of new cities like Dubai or ancient cities like Rome with Zaha Hadid &apos;s incredible MAXXI museum , or like right here in New York with the High Line , a city which has been so much influenced by the development of this .","New cities like Dubai, ancient cities like Rome, the 21st century museum of Zaya Hadad, and here in New York, it has been profoundly influenced by the development of several highways."
窓やドアの向こうから 幼い子供たちが こちらを覗き見ており マココは人で 溢れている一方で 実は 何より驚くのが 全ての建物が子供で 溢れていることです,"Behind every window and door frame , you &apos;ll see a small child peering back at you , and while Makoko seems to be packed with people , what &apos;s more shocking is actually the amount of children pouring out of every building .","Beyond the windows and doors, little children stare down at us, while Macco is full of people, the truth is, all your buildings are full of children."
長年の間 ザバリーンの人々は 仮設の村に住み 地方行政を避けるため 遊牧民のような生活をしてきました しかし 1980年代初頭に カイロの東の辺境に位置する モカタム岩に定住しました,"For years , the Zabbaleen would live in makeshift villages where they would move around trying to avoid the local authorities , but in the early 1980s , they settled on the Mokattam rocks just at the eastern edge of the city .","Over the years, Xavier's people lived in temporary villages to avoid local affairs, surrounded by Bedouins, but lived like Bedouins in the early 1900s."
今日紹介した これらの場所を見ると 実は 「 普通 」 などないということに 感銘を受けます そして 人はどのような環境にも 適応できることを 証明しています,"In all these places I &apos;ve talked about today , what I do find fascinating is that there &apos;s really no such thing as normal , and it proves that people are able to adapt to any kind of situation .","When I look at these places today, I'm impressed that there's no normal anymore, and I'm determined that people can adapt to any environment."
ラビン元首相は オスロ ・ プロセスに関わった際 「 和平は友と結ぶのではない 和平とは 敵と結ぶものだ 」 と言いました 困難ですが 必要なことなのです,"Prime Minister Rabin said when he engaged the Oslo process , &quot; &quot; You don &apos;t make peace with your friends , you make peace with your enemies . &quot; &quot; It &apos;s hard , but it is necessary .","Former Prime Minister Gavin said that peace is not for people, but for enemies."
それから 60年を経た今 人々は街を 当初設計された目的とは 全く別の方向で使用しています 例えば この人たちは 集会所の窓を 椅子代わりにしています,"Now 60 years later , the city has been taken over by people in very different ways from whatever perhaps intended for , like here , where you have the people sitting in the windows of the assembly hall .",Now it's been 60 years since then that people use the city in a whole other way than the purpose for which they originally designed it.
ある日突然 NGOは街頭でスローガンを叫ぶだけでなく 交渉の場に参加するようになりました 彼らがこうした武器の犠牲者を 代表していたことが理由の一つです,"All of a sudden , NGOs were not only standing in the streets , crying their slogans , but they were taking &#91; them &#93; into the negotiations , partly because they represented the victims of these weapons .","One day, a typhoon not only screamed a rally and joined the negotiations, one of the reasons they represented the victims of these weapons."
キャリアを通じて 私は幸運にも 世界中のすぐれた建築家の キャリアを通じて 私は幸運にも 世界中のすぐれた建築家の 仕事を記録し 彼らの仕事がどのように 都市に影響を及ぼすか 観察することができました,"Throughout my career , I &apos;ve been fortunate enough to work with many of the great international architects , documenting their work and observing how their designs have the capacity to influence the cities in which they sit .","Through my career, I had a fortunate chance to record the work of the best architects around the world, observe how their work affects the city."
もし我々がこうした集団に対して 民主主義に移行して 国家間の正常で文明化された関係の 一端を担うようになれば 利益があるのだと 示すことができなければ どうなるでしょう ?,"And if we cannot demonstrate to these groups that if you move towards democracy , if you move towards taking part in civilized and normal standards among states , there are some rewards on the other side .",What happens if we can move to democracy and assume a part of a normal civilized relationship between the two nations if we can't?
最後に 私の友人であり インスピレーションの源である ジータ ・ コブという ニューファンドランドの フォーゴ島を拠点にする ショアファスト基金の 創設者の言葉を引用したいと思います,"I would like to end with a quote from a friend of mine and a source of inspiration , Zita Cobb , the founder of the wonderful Shorefast Foundation , based out of Fogo Island , Newfoundland .","Finally, I'd like to quote the founders of the Shoreface Foundation based in Fort Worth, Newfoundland, where my friend, Ziva Cobb, is the source of inspiration."
初めてインドに行った時訪れた家は 土間で水道もなければ 電気もない状態でした それでもこれが世界中で見られる実際の光景なのです,"My first trip in India , I was in a person &apos;s home where they had dirt floors , no running water , no electricity , and that &apos;s really what I see all over the world .","When I first visited India, there was no soil, no water, no electricity, but still, this is a real sight all over the world."
外交における正当性とは何でしょう ? 地域において広域の力を持つ 我々があいまいに集団と呼んでいる 彼らのことを理解し 外交に反映することができないならば 我々外交官が生み出す 問題解決の正当性は何でしょう ?,"What is the legitimacy of diplomacy , of the the solution we devise as diplomats if they cannot be reflected and understood by also these broader forces of societies that we now very loosely call groups ?","If we diplomatists can't understand them, if we can't apply to diplomacy, if we can't understand them, then what's the right thing to do to solve the problem?"
私たちが行なっている 公共スペースのプロジェクトでは すべて地元の企業や商人団体と 緊密に働きます すべて地元の企業や商人団体と 緊密に働きます スペースを維持したり 街路の家具を移動したり 植物の世話をしてくれる人々です,"With all of our projects , our public space projects , we work closely with local businesses and local merchant groups who maintain the spaces , move the furniture , take care of the plants .","In every project we run, we work with local corporations, merchant groups, people who use my speed to maintain space, relocate office furniture, take care of plants."
1968年を救った写真だと 多くの人が言う有名な写真です 緊迫した年だった1968年は パリの五月革命が起き ベトナム戦争の真っ最中でした,"A famous picture ; many people have said that it &apos;s the picture that saved 1968 , which was a turbulent year — the student riots in Paris , the height of the Vietnam War .","It's known as the picture that saved the year 1939, when the Paris War had begun in the midst of the Vietnam War."
我々が もし民主主義を説く一方で 彼らを代表する集団と 交渉しないのであれば ダブルスタンダードと言われても当然です,"How can we escape &#91; having &#93; a double-standard , if we at the same time preach democracy and at the same time don &apos;t want to deal with the groups that are representative ?","If we don't negotiate with the group that represents democracy while we talk about democracy, it's no wonder they're called double standards."
また 数年間にわたって 北京に建てられた レム ・ コールハースの 中国中央電視台本部ビルや ヘルツォーク & ド ・ ムーロンの オリンピックスタジアムの 建設現場を追いました,"But over the course of several years , I &apos;ve been documenting Rem Koolhaas &apos;s CCTV building in Beijing and the olympic stadium in the same city by the architects Herzog and de Meuron .","In the course of several years, I've traced the construction site of the Chinese central observatory buildings, the Hertfordshire Olympic Stadium."
人々や市民団体を 問題の一部としてではなく 解決策の一部として 取り込むことができなければ 交渉によって気候変動問題を 解決することはできないでしょう,"How are we going to solve climate change through negotiations , unless we are able to make civil society and people , not part of the problem , but part of the solution ?","If we can't take care of people and citizens as a problem, then we can't solve climate change with negotiations."
建設期間が何年にもわたると 雑然としていながらも 街としての機能を備えた 労働者の集落ができます 彼らが建築している洗練された建物とは 対照的です,"As the length of the construction takes years , workers end up forming a rather rough-and-ready informal city , making for quite a juxtaposition against the sophisticated structures that they &apos;re building .","After all these years of construction, it'll be a gathering of workers loyal to the city, as opposed to the sophisticated buildings they're building."
彼らは与えられた環境の中で 自分たちのスペースをなるべく 綺麗で居心地よくしようとします,"They typically make the best out of their conditions , and try to make their spaces look nice and homey , or at least up until as far as they can reach .",They try to make their space as clean as possible in your given environment.
住人たちがそれぞれ 独自の適応方法を見出すことで 住人たちがそれぞれ 独自の適応方法を見出すことで このタワーはミクロ経済と 中小ビジネスが活発な このタワーはミクロ経済と 中小ビジネスが活発な 生きた街のようになるのです,"And with each inhabitant finding their own unique way of coming by , this tower becomes like a living city , a place which is alive with micro-economies and small businesses .",This tower is a thriving city of micro banking and small business.
タワーに新しく越してくる人は 屋根はすでにあるので 住みたい場所を カーテンや敷物で区切ります,"When a new inhabitant moves into the tower , they already have a roof over their head , so they just typically mark their space with a few curtains or sheets .","Anyone new to the tower has a roof over your head, so you can do whatever you want wherever you want to live, the curtains and rugs."
私がマココを訪れた そもそもの理由は 友人のクンレ ・ アデイェミが マココの子供たちのために 立ち上げた 三階建ての水上校舎を作る プロジェクトに参加するためでした,"What originally brought me to Makoko was this project from a friend of mine , Kunlé Adeyemi , who recently finished building this three-story floating school for the kids in Makoko .",The only reason I visited markovia was to join the project that my friend Kringle Adami instituted to build a three-story water park for the McNamara kids.
このような集まりは 興味深い対比を浮き彫りにします このような集まりは 興味深い対比を浮き彫りにします 新品が飾られている一方で 新居の調度品を展示するための 小道具として ゴミが混在しているのです,A gathering like this one offers such a juxtaposition where all the new stuff is displayed and all the garbage is used as props to display all their new home accessories .,"A gathering like this funnily turns you into a change of scenery, where the rest of the garbage is placed as a prop for exhibiting brand-new objects."
対人地雷禁止条約および クラスター爆弾禁止条約は 市民団体を関与させるという 従来の外交政策からの転換がなければ なしえなかったことでしょう,"We could never have done the convention against anti-personnel landmines and the convention that is banning cluster munitions unless we had done diplomacy differently , by engaging with civil society .","Well, I'm guessing the anti-personnel blast act and the Craster Anti-matter Act would have been suppressed from the traditional diplomatic policy that allowed civilians to be involved."
この住人たちは文字通り 自らの手で家を建てます そして この愛情に満ちた努力が このタワーに住む 多くの家族の誇りになるのです,"The inhabitants literally built up these homes with their own hands , and this labor of love instills a great sense of pride in many families living in this tower .","These people literally build their own houses, and this loving effort will be the pride of many families who live in this tower."
30階にはジムがあり 重りやバーベルには 備え付けられることのなかった エレベーターの滑車を使っています,"And on the 30th floor , there is a gym where all the weights and barbells are made out of the leftover pulleys from the elevators which were never installed .","There's a gym on the 30th floor, and they use elevators that can't be installed with weight or barbell."
しかし この牛小屋の向かいにある 部屋には新婚の夫婦が 住んでおり 地元の人曰く この地域で最も 素敵なアパートらしいです,But then in the apartment across the hall from this cow shed lives a newly married couple in what locals describe as one of the nicest apartments in the area .,"But on the other side of this cowhouse, from what appears to be the house of the newlyweds, the best apartment in the area, according to the locals."
コミュニケーションのスキルを 向上させなければ より大きな 「 私たち 」 を作って 我々の問題に対処することはできないのです,How are we going to settle and build a bigger &quot; &quot; We &quot; &quot; to deal with our issues if we don &apos;t improve our skills of communication ?,"If we don't improve our communication skills, we won't be able to create a bigger ""we"" and address our problems."
タワーの中では 色々なサービスを 目にします たとえば理髪店や 小さな工房 そして各階に 小さな食料品店や店があります,"Throughout the tower , you come across all kinds of services , like the barber , small factories , and every floor has a little grocery store or shop .","In the tower, you will see all kinds of services, like hair shops, small workshop, and the small grocery stores on each floor."
ゲイツ財団の仕事で 私が一番好きなのは 発展途上国を訪れることができることで 実際かなり頻繁に行っています,"One of my favorite parts of my job at the Gates Foundation is that I get to travel to the developing world , and I do that quite regularly .","Out of the Gates Endowment's work, my favorite part is that I go there quite often."
私達が子供に願うことは同じなのです 子供達が大きくなって成功し 健康で幸せな人生を送って欲しいのです,"They want what we want for our children and that is for their children to grow up successful , to be healthy , and to have a successful life .","It's the same thing that we want our children to succeed in growing up and having a healthy, happy life."
このようなことはエチオピアのような国では 大きなインパクトがあるのです このおかげでエチオピアの子供の死亡率が 2000年から2008年にかけて 25 % 低下しました,"That is having real impact in a country like Ethiopia , and it &apos;s why you see their child mortality numbers coming down 25 percent from 2000 to 2008 .","Things like this have such a big impact on countries like Ethiopia, and thanks to that, the death rate of Ethiopia children dropped by 25 percent in 2000 to 2005,."
しかも何が人々を幸せにするか想像するのでなく 例えばラテンアメリカなどに出かけて行って そこでは幸せが家族との生活に関係していると 理解した上で行なっています,And they don &apos;t just guess what makes people happy ; they go to places like Latin America and they realize that happiness there is associated with family life .,"And he doesn't suspect what makes people happy, but he goes to Latin America because he understands that happiness has something to do with family life."
10億人以上の人々が暮らしています でも麻痺症の報告をする 地域の医師が3万5000人いて 臨床医や薬局からの大規模な報告システムがあります,"They have over a billion people in this country , but they have 35,000 local doctors who report paralysis , and clinicians , a huge reporting system in chemists .","There are over a billion people living in the world, but there are 35,000 local doctors reporting paralysis, and they have a large reporting system from clinics and pharmacy."
重要なことは これが我々が おそらく初めて目にする アラブ世界の歴史上初の ボトムアップの革命であり 民衆主体の革命だということです,"The point is that we are probably seeing , for the first time in the history of the Arab world , a revolution bottom-up — people &apos;s revolution .",What matters is that this could be the firstbottom-up revolution in the history of the Arab empire and the revolution of the people.
将来 私たちは 人々や市民団体から断絶した 外交政策ではなく こうした成功例を参考にする必要があります,"In the future , I believe , we should draw examples from these different illustrations , not to have diplomacy which is disconnected from people and civil society .","In the future, we need to look at an example of success, not a diplomatic policy cut off from people and citizens."
地元の建築家や シンクタンクの方から トーレ ・ デ ・ ダビの話を聞きました カラカスの中心に位置する 45階建てのオフィスビルです,"During a conversation with local architects Urban-Think Tank , I learned about the Torre David , a 45-story office building which sits right in the center of Caracas .",I've heard a lot of local architects and think tanks say Thore De Davidi owns a 45-story office building in the center of Caracas.
さて アフリカはナイジェリアの マココというコミュニティーに 話を移しましょう ラゴス ・ ラグーンの水上で 15万人の人々が 生活をしているスラムです,"Let &apos;s go now to Africa , to Nigeria , to a community called Makoko , a slum where 150,000 people live just meters above the Lagos Lagoon .","Well, in Africa, we're talking about a community called Macoco, which is a slum of 150,000 people living in Raw acres of water in the labyrinth."
これらの特殊な空間に 暮らし 働き 遊ぶ人々によって 作られているため こうした地域はその環境を 十分生かすように 直感的に設計されています,"Created by these very people who live , work and play in these particular spaces , these neighborhoods are intuitively designed to make the most of their circumstances .","Because these specific spaces are made by people who live and work and play, this area is designed gut-wrenching to stay alive enough."
彼女はこう言いました 「 均一性という病が ― 生きる喜びを奪っている 」 まさにその通りだと思います,"She says that &quot; &quot; there &apos;s this plague of sameness which is killing the human joy , &quot; &quot; and I couldn &apos;t agree with her more .","She said, ""The disease of optimism is taking away the joy of living,"" I think she's right."
( 拍手 ) そして機械的機構がなくなる代わりに 電線が使われると言います,"( Applause ) They then pointed out that there &apos;d be , sort of , the other controls by wire , to get rid of all that mechanical stuff .",And they say the wires will be used instead of their mechanical functions.
この問題に関する情報はあまりにも多く 様々な形で 皆さんに提供できます,"And maybe to put that in perspective : there &apos;s so much data on this , I &apos;ll be happy to give it to you in different forms .","There's too much information about this problem, and I can provide it in many ways."
そしてなにより 我々が 多数派の権利を尊重しないとしたら ムスリム同胞団に 少数派の権利を尊重すべきであるなどと どうして言うことができるでしょうか ?,"And how can we tell the Muslim Brotherhood , as we should , that they must respect minority rights , if we don &apos;t accept majority rights ?",And am I to understand that if we don't respect the rights of many.. the Muslim Party should respect the rights of a few?
8年ほど前から この廃墟ビルに 人々が移り住み始め ― この作りかけのビルの 支柱の間に 家を作り始めたのです,"About eight years ago , people started moving into the abandoned tower and began to build their homes right in between every column of this unfinished tower .","Eight years ago, people moved into this abandoned building, and they started building a house between the pillars of this unburdened building."
この未完成のタワーで 生活していく上で 出てくる諸問題に対して 住人たちは様々な解決策を 編み出しました,"Within the tower , people have come up with all sorts of solutions in response to the various needs which arise from living in an unfinished tower .","While living in this unfinished tower, townspeople have put together a series of solution to matters related to it."
でもコカコーラはあることに気づきました 現地の人々が商品をまとめ買いして コカコーラの手が届かない地域で売っていることです,"But Coke noticed something — they noticed that local people were taking the product , buying it in bulk and then reselling it in these hard-to-reach places .","But then I realized there's something about Coke, that people used to collect merchandise and sell them in neighborhoods where Coke can't be traced."
医者は8月14日と15日に便サンプルを採取し 8月25日には 1型ポリオであると確認されました,"On August 14th and 15th , they took a stool sample , and by the 25th of August , it was confirmed he had Type 1 polio .","The doctors took the flight samples on August 14th and 15th, confirmed to be one series polyo."
そして20世紀には革命がありました この革命は20世紀の初めに起こり まだ続いています,"Now , in the 20th century we had a revolution that was initiated at the beginning of the 20th century , and which is still going on .","And there was a revolution in the 20th century, and this revolution happened at the beginning of the 20th century, and it still goes on."
同時に 私たち物理学者は 量子論や相対性理論を理解し 組み合わせ 発展させるのに 時間を費やしてきました,"At the same time , we physicists have been busy trying to make sense of and build on and integrate the discoveries of quantum theory and relativity .","And, at the same time, our physicists have spent a lot of time understanding and combining the theory of quantum mechanics and relativity."
これはブルックリンのベッド ・ スタイ 短い道があったことが分かります 車のためで あまり必要ではありませんでした,"This is in Bed-Stuy , Brooklyn , and you can see the short leg that was there , used for cars , that &apos;s not really needed .","This is Brooklyn bed Stuy, which means there was a short road for a car that didn't need much of a ride."
私たちは この方法を バスにも適用していて ニューヨーク市の バス車両台数は 北米最大ですが 速度は一番遅いです,"We &apos;ve also brought this approach to our buses , and New York City has the largest bus fleet in North America , the slowest bus speeds .","We're applying this process to buses, and New York City's bus schedules are the biggest in North America, but they're the slowest."
画面では表面しか見えませんが 氷は おそらく何百kmもの厚さがあります,"So what you &apos;re looking at is the surface of the moon Europa , which is a thick sheet of ice , probably a hundred kilometers thick .","It's the board, but the ice is probably hundreds of kilometers thick."
