sent,reference,translation
皆が活動したことによって 変えることができたのです,"But it was the actions , together , of all of us that brought about that change .",It could have been changed by the fact that everyone got it.
ある夜 廊下に座っていると 女の子たちが近づいてきて言いました,And I was sitting in a hallway one night and a couple girls came up to me .,"One night I was sitting in the hallway, and the girls approached and said,"
最初の曲は英語で 2番目の曲は中国語で作詞しました,"And the first song I wrote was in English , and the second one was in Chinese .",The first one was in English and the second one in Chinese.
その子の目の光の中に ずっと留まっていたいと願いました,And the light that shone off of her eyes was a place I could have stayed forever .,I wish I could stay in the light of the child.
人は皆 加齢し 病気し 死にます 時は止まりません,We all die . We all get old . We all get sick . People leave us .,"We all wash away, sick, dying, time will not stop."
現実の隣にあるもう一つの世界の話が好きでした,I loved when he was talking about this other world that &apos;s right next to this world .,I loved a story about another world next to reality.
彼らは私の考える新たなパラダイムの 基盤である自由と積極性を持ち合わせており,They have a fierceness and a freedom that I believe is the bedrock of a new paradigm .,They're using freedom and resourcefulness based on the premises of a new paradigm I perceive.
しかし 暑いので彼らは 休憩時間中 そこから口に,"But they also drink from them while they &apos;re in their breaks , because it &apos;s hot .",But it's very hot.
フィリピン人の活動家が私に言いました 「 餅はどうやって作るか知ってる ?,"A Filipina activist once said to me , &quot; &quot; How do you cook a rice cake ?","A Philippines live-wire said to me, ""Did you know how mxs are made?"
マルクスの言うところによると 、 「 女性は変化をもたらす だが 思うままにではない 」,"So to paraphrase Marx : Women make change , but not in circumstances of their own choosing .","According to Marcs, women make a difference, but they don't change when they want to."
彼女達は抑圧する伝統を覆し 、 新しい希望を見つけなければなりません,They have to subvert tradition that once silenced them in order to give voice to new aspirations .,They must overcome the tradition of oppression and find new hope.
1ヶ国語しか話さない家庭でも バイリンガルが育つガイドもありますし,There are guides to raising a bilingual kid even if you only speak one language at home .,"In a home that only speaks one language, there's a guide to growing bilingus."
「 危機 」 は言い過ぎと 思われるかも知れませんが データによると 言い過ぎではなさそうです,"Crisis might seem like a strong word , but there is data suggesting it probably isn &apos;t .","I know it sounds a bit of an exaggeration, but according to the data, it's not an exaggeration."
子どもは赤の他人と同等 」 ( 笑 ) しかしポイントはここです,Who are on par with strangers . &quot; &quot; ( Laughter ) But here &apos;s the thing .,"The child is equal to others."" (Laughs) But here's the point."
3年ほど前 あるテキサスの女性の ある言葉に ひどく胸が痛みました,"About three years ago , a Texas woman told something to me that totally broke my heart .","About three years ago, ain't my chest very good enough for ain't it?"
誤解しないでいただきたいのですが 幸福は子どものゴールとして 素晴らしいとは思います,And don &apos;t get me wrong : I think happiness is a wonderful goal for a child .,"I hope you don't get me wrong, but happiness is a great goal for a child."
幸福や自信を 子どもに教えるというのは 畑の耕し方を 教えるのとは違います,"Happiness and self-confidence , teaching children that is not like teaching them how to plow a field .",It's not like teaching Hatake how to be happy and confident.
体自体の重みや物理的な特性を ちょうど振り子のように 利用しているのです,"You &apos;re using your built-in dynamics , the physics of your body , just like a pendulum .",They're using the weight of the body itself and its physical properties as a pendulum.
これはIMPASSにできる面白いことの ほんの一例です,"So , these are just some examples of the neat things that we can do with IMPASS .",This is just one example of something interesting that can be faked.
商用で非常に良いロボティクスハンドはたくさんありますが,"There are a lot of really neat , very good robotic hands out there in the market .",There are a lot of commercial and very good robotics hands.
だから義肢という用途で使うのは あまり現実的ではありません,"So , for prosthesis applications it &apos;s probably not too practical , because it &apos;s not affordable .",That's why it's not very realistic to use it as a servant.
柔軟にできていて 空気圧を変えるだけで 力加減を簡単に変えられます,"It is compliant . You can actually change the force , simply just changing the air pressure .","It's designed to modulate, change the atmospheric pressure, there's no need to change the pressure."
このDARwInには実際ファンクラブがあります 「 ダイナミック人型知的ロボット 」 です,"We actually have a fan club for the robot , DARwIn : Dynamic Anthropomorphic Robot with Intelligence .",There's in fact a fan club called the Dynamic intelligent robots.
この競技会にアメリカから参加したのは 私たちが最初でした,We were the very first team in the United States that qualified in the humanoid RoboCup competition .,We were the first Americans coming to this tournament.
私たちのラボRoMeLaでは 素晴らしい ブレインストーミングセッションをやっています,"At our lab RoMeLa , the Robotics and Mechanisms Laboratory , we have these fantastic brainstorming sessions .","Our lab, a state-of-the-art brainstorming seminar."
みんな集まって 課題や 社会的問題について議論し 話し合います,"So , we gather around , we discuss about problems and social problems and talk about it .",We're all gathered here to discuss the obstacles with social movements.
TEDで素晴らしい講演がありました ケン ロビンソン卿です,"There was a great TED moment , I think it was Sir Ken Robinson , was it ?",It was a great talk at the TED. Ken Robinson.
私は学生にいつも言っています 「 賢く働き そして熱心に働くこと 」,"So , I always tell my students , &quot; Work smart , then work hard . &quot;","I always tell my students, ""Get smart and work passionately."""
私にとって一番 強烈だったのは その 「 通りすがり 」 の人が 実は私の生徒だったときのことです,"For me , the time I remember best is when that stranger was a student of mine .","You know, the worst thing that ever happened to me was when a bystander was actually one of my students."
2人目は 魅力的だけど謙虚なので 主人公の男性の赤ちゃんを産むのに ふさわしいタイプです,"The second is desirable but modest , and therefore worthy of our leading man &apos;s future babies .","The second one is charming but humble, and he's the right type to have a baby boy."
禁止すべきなのは 社会が女性に対し 自分の体に何をするのかに 口出しすることです,What needs to stop is society telling women what they can and cannot do with their bodies .,What is forbidden is the business of what society does to a woman.
そして セックスについて 子供に話すときには 生殖の話だけに こだわらないでください,"And when you &apos;re having those conversations about sex , don &apos;t center them on reproduction only .","And when you talk about sex to a child, don't insist on talking about reproduction."
ところで ある研究によると 謎を解くことは人間にとって 食事や睡眠と同じくらい根源的です,"Now , it turns out research tells us that solving is as primal as eating and sleeping .","And by the way, tests have shown that the nightmare is as important to humans as the food and sleep."
次のマーカーを取って キャップを外して 楽しいでしょう ?,And pick up another marker for me and take off the cap . Isn &apos;t this fun ?,"Take your next marker, take off your cap, it's gonna be fun, right?"
仕事が成功していたら 私たちの存在は気づかれないはずです,"And if we did our jobs well , you won &apos;t know that we were even involved .","If we would have succeeded, no one would have recognized us."
ベンジャミン : ママとティズィーは ― 数年の命と言っていたけど ―,"BP : I heard momma and Tizzy whisper , and they said I was gonna die soon .","Mom and Tide said it was years of life, but..."
デイビットは年を重ねたしわを表現するのに ブラッドの顔の奥深くまで切り込んでいきたかったのです,And David wanted to carve deeply into Brad &apos;s face to bring the aging to this character .,David wanted to go deep into Brad's face to express her advancing years.
私たちにはベンジャミンにー 人間ができる全てのことをさせる必要があったのですが,So we needed a system that would allow Benjamin to do everything a human being can do .,We had to let Benjamin do everything humanly possible.
しかしこの技術は当時まだ生みだされて間もなく 確実性はありませんでした,"But these were the early days of this technology , and it wasn &apos;t really proven yet .",But this technology was not probable at the time.
それから得られるデータがこちらです モデル上のデータですね,"And here &apos;s the resulting data that comes from that , the model that comes from that .",Here's what we're going to get. The data from the model.
私たちはデジタル人形を作って ブラッドにその顔を操ってもらいました,"So , effectively we created a digital puppet that Brad Pitt could operate with his own face .",We made a digital doll so Brad could manipulate the look on his face.
その笑顔が意味するのは皮肉なのか嬉しさなのか落胆なのか 判断できないのです,"It doesn &apos;t recognize an ironic smile , or a happy smile , or a frustrated smile .",You can't decide if that smile's technically ironic or happy or disappointing.
造船所は 騒々しく危険で 危険な毒物に溢れ 健康と安全が脅かされる場所です,"The shipyard was noisy , dangerous , highly toxic , with an appalling health and safety record .","The shipyard is full of noise, dangerous poisons, where health and safety are threatened."
そして 欧米諸国は 何が起きているかを ほとんど把握できていないことに気づいたのです,And we find out in the West that we know very little about what &apos;s happening .,And I realized we have little idea what's going on in the West.
現在も 議論は続いています 「 我々は ムスリム同胞団と対話すべきか ?,"Right now , the discussion goes , &quot; &quot; Should we talk to the Muslim Brotherhood ?","We're still arguing, ""Should we speak to the Muslim Brotherhood?"""
我々は 外交レベルでの対話と 政治レベルでの対話を区別しています,We make a distinction between talking from a diplomatic level and talking at the political level .,We mark the difference between diplomacy and politics.
コニュニケーションを強化するために 使用できる 外交のための道具箱には 実際たくさんの道具が揃っているのです,The diplomatic toolbox is actually full of different tools we can use to strengthen our communication .,"There are, in fact, a lot of tools in the toolbox for diplomacy that we can use to enhance communication."
ただ必要なスキルを向上させ それを使う勇気を持つことが必要なのです,"We need to improve the necessary skills , and we need the courage to use them .",I need you to improve your skills and have the courage to use them.
つまり私が驚くのは いかに彼らが何も所有していないかということです,"So in short , I &apos;m startled by all the things that they don &apos;t have .","I mean, what I'm surprised at is how they don't own anything."
コカコーラがやっているのに 政府やNGOはどうして同じことができないんだろう ?,"If they can do that , why can &apos;t governments and NGOs do the same thing ?",Why can't governments and UNs do the same thing when Coke's doing it?
あるNGOの人物に言わせれば これは暗闇でボーリングをしているようなものです,I had somebody from an NGO once describe it to me as bowling in the dark .,"If you ask one of the arbitrators, it's like bowling in the dark."
球を投げるとピンがいくつか倒れる音がする,"They said , &quot; &quot; You roll the ball , you hear some pins go down .",Throwing the ball makes a few pins fall.
そしてアフリカの僻地では 舗装道路を見つけるのが大変です,"And in Africa , the remote places , it &apos;s hard to find a good road .","And in the middle of Africa, it's hard to find a paved road."
そしてエチオピア政府は2003年に 自国でこの新しいシステムを開始したのです,"And in 2003 , the government of Ethiopia started this new system in their own country .",And the Espheni government launched this new system in its own gula.
それからトイレを見せて これは近代的な最新設備だと 位置づけするのです,"But then you take the toilet and you position it as a modern , trendy convenience .",Then show me the bathroom. This is the most modern in the business.
ポリオは2番目に地球上から 撲滅された単なる病気となるのです,And it would only be the second disease ever wiped off the face of the planet .,Polyo is the second type of disease that has been eradicated from the earth.
500年前に帆船が十分実用的になり 我々は新しい大陸を発見しました,"500 years ago , sailing ships started getting reliable enough ; we found a new continent .","Five hundred years ago, the sail ships were fully operational, and we discovered a new continent."
それらは大切で 居間の飾り物ではありません,I love them all . I don &apos;t keep any of them in my living room .,"They're important, not living room decorations."
数字には幅がありますが 1日あたり6万から8万5千人です,"Depending on whose numbers you believe , it &apos;s between 60 and 85,000 people per day .","It's a lot of numbers, but it's between 60,000 and 85,000 a day."
最先端の研究を行い 従来と違うやり方で進めたい,"We want to be in the forefront fields , and we want to do it differently .",And we'd like to use cutting-edge research to proceed in a very different way.
そして 20世紀には 我々は科学の分野で二つの大きな テーマが独立して発展したのを見てきました,"In the 20th century , we saw the independent development of two big themes in science .","And in the 20th century, we've seen two great threads expired independently in the field of science."
多くの都市にとって 街路は 長い間 冬眠状態のようでした,"For many cities , our streets have been in a kind of suspended animation for generations .",Most of the city's streets were in hibernation for a long time.
第一段階の完成を祝うテープカットは 今年の12月に行われます 第一段階の完成を祝うテープカットは 今年の12月に行われます,"And we will be cutting the ribbon on this , the first phase , this December .",The ribbon cuts are going to take place this December to celebrate stage one perfection.
約10万平方メートルもの 使用中の車道を 新しい歩行者天国にしました,We &apos;ve repurposed 26 acres of active car lanes and turned them into new pedestrian space .,"They've sealed off approximately 100,000 square meters of roads that are occupied by a new walker heaven."
歩行者 自転車 車のドライバーの負傷率は ― 50 % も下降しました,"Injuries to all users , pedestrians , cyclists , drivers , are all down 50 percent .","Loss rate of walkers, bikes, and car drivers has risen to 50 percent."
昔は左のような男性でしたね 忍者のような バイクメッセンジャー,"In the past , it looked like the guy on the left , ninja-clad bike messenger .","You used to be a man on the left, a motorcycle messenger like a ninja."
皆さん ご存知のとおり 町を移動するなら バスに乗るより 歩いた方が早いです,"As everybody knows , you can walk across town faster than you can take the bus .","Ladies and gentlemen, if you're moving into town, you're walking faster than riding the bus."
ゆっくりとエンケラドスの 数百km上空を通りました,"So it made a very low pass , just a few hundred kilometers above the surface .",Slowly passing hundreds of miles above the enchantments.
これは光を吸収している ― 太陽周辺の大気の中にある原子の写真です,"And now , this is a picture of atoms in the Sun &apos;s atmosphere absorbing light .",This is a photograph of the atoms in the atmosphere around the sun absorbing rays.
それだけの質量をもつ星があった場合,What happens when you have a star that &apos;s right on the edge of that mass ?,If there were stars with such strength.
第一世代の星に 炭素と酸素はありませんでしたが,And there was no carbon and oxygen in the universe throughout the first generation of stars .,There was no carbon and oxygen in the first generation.
これは衛星に見えますが 地球の写真です,"It looks like a moon , but in fact , it &apos;s a picture of Earth .","This looks like a satellite, but it's a picture of the Earth."
未来のスターたる このロボットには Twitterアカウントもあります @ robotinthewild です,"The bot , our rising celebrity , also has his own Twitter account : @ robotinthewild .","This robot, the future star, has the SIM account."
ネタやパフォーマンスが気に入らなければ 赤を出してください,"If you don &apos;t like the subject or the performance , you can hold the red .","If you don't like a story or a standing gig, please pin it red."
そのすべては地表水に紛れ込み ついに最終堆積場である 海に到達します,"And all that gets into surface waters , eventually reaching the ocean , the final sink .",It all gets lost in the surface water and finally reaches the end of the ocean.
さんご礁はご存知の通り 全ての海洋生物の 約4分の1の住処です,"Corals are , you know , the home to about a quarter of all marine species .","As you know, Mr. Lotus is about a quarter of all marine life."
私たちには当然知る権利があります メキシコ湾で経験する損失をです,Surely we have the right to learn what loss we are going through in the Gulf .,We have every right to know the losses that we've experienced in the gulf.
両親もそうだったんですが 海外留学が終わった私は帰国しました,"And just like my parents did when they finished studying abroad , we went back home .","My parents were the same, but after my overseas tuition ended, I came home."
これはナイジェリアとかアフリカ全般に見られる問題の一つです,"See , that &apos;s one of the problems we have in Nigeria and in Africa generally .",It's one part of the problem known to all of Nigeria and Africa.
この企業の唯一の目的は無いものを提供していくことです,This one &apos;s sole aim is to provide the very things that I think are missing .,The corporation's sole purpose is to provide something that doesn't exist.
ソーラーパネルもあって ここからも電力を供給できますし,"Yes , it will take a solar panel . Yes a solar panel will charge it .",There's a solar panel. We can power it from here.
メインバッテリーを充電することも出来るんです,"But if you &apos;ve got mains as well , it will charge the batteries in there .",I can charge the main battery.
これは最新技術ではありませんが 私達はこれを活用しています,So that &apos;s not new . What we &apos;re doing is applying this technology to it .,"This isn't the latest technology, but we're using this."
大きい脳は必ずしも — ニューロンが多いという 訳でもないかもしれません ニューロンが多いという 訳でもないかもしれません,Maybe a very large brain does not necessarily have more neurons than a more modest-sized brain .,Maybe big brains don't always have a lot of neurons.
私は いきなり混乱しました 光は物質の温度を上げますが,"Now he confused me from the very start , because light doesn &apos;t cool things down .",I suddenly was confused. The light raises the temperature of matter.
ここに科学の面白さがあります 実験によって 直感が 裏切られる面白さです,And this is the great pleasure of science : the defeat of our intuition through experimentation .,"Here's the fun of science, the fun of experimentation disguising your instincts."
でも アートに対する 公的資金を削ると 問題も生じます,"However , once we eliminate public funding for the arts , there will be some drawbacks .",But there's a problem with getting rid of public funds for art.
そして使わない時間に対しては 一切お金を払わない,"All those hours when a car is sitting idle , I &apos;m not paying for it .",And I'm not paying for time that I don't use.
サーフィンなら 大きなエレメントにも乗れます,I can drive my Toyota Element when I &apos;m going to go on that surfing trip .,"I'm only only only going surfing, and I can ride the biggest Element of my career."
Zipcarは世間に受け入れられていますし 愛されてもいます,"People adore the company . And it &apos;s better , you know ? They like it .",There's a lot of people thinking that Diocar is adored and loved.
さらに Zipcarの実現にはテクノロジーが不可欠でした,And the last point I want to make is Zipcar would never be possible without technology .,"Furthermore, the technology was essential to applying AFcar."
ワイヤレス技術なしで このコンセプトは実現できません,"So , without these wireless technologies , this , as a concept , could never happen .","Without wireless technology, this concept cannot be achieved."
素晴らしい 一人で運転したいなんて思いませんよね ?,How fabulous . Why would you ever want to go by yourself in your own car ?,"Great. You don't want to drive alone, do you?"
駐車場の需要や 渋滞や 二酸化炭素排出量が減ります,"The demand for parking , of course , is down , congestion and the CO2 emissions .","Reduced traffic, random traffic, CO2 emissions."
最後は ロンドンで導入され注目された渋滞課金制度です,"So , the last example of this is congestion pricing , very famously done in London .","And lastly, the remarkable traffic allowance was introduced in London."
しかし 宇宙には実は音があり 「 無音の映像 」 などではないのです,"And yet , the universe is not a silent movie because the universe isn &apos;t silent .","But there's a sound in the universe, not a sound."
空間は ブラックホールから 拡散しながら 同時に伸び縮みし 宇宙を激しく叩きます,Space squeezes and stretches as it emanates out from these black holes banging on the universe .,"Space spreads from a black hole, paralyzed at the same time, knocking out the universe hard."
吸い込まれるにつれ だんだんと速く そして大きな音になるでしょう,"We know that , as it falls in , it gets faster and it gets louder .","Every time I get sucked in, it'll get faster and louder."
ふたつのブラックホールは衝突し 何十億年という時間スケールで合体しようとしているのです,"These two black holes are colliding , and they will merge over a billion-year time scale .","Two black holes are colliding, converging with a billion-year time scale."
どこもかしこも 辺り全てビッグバンです 空間はぐちゃぐちゃに揺れています,"It &apos;s everywhere , it &apos;s all around you , and the space is wobbling chaotically .",There's a big bang everywhere.
時は経ち 4万年前 私たちは洞窟に絵を描いていました,"It gets closer and closer — 40,000 years ago , we &apos;re still doing cave paintings .","As time went on, 40,000 years ago, we painted in caves."
彼女が旅をしているのは選挙のときに 国外にいたからです,She is traveling because she was out of the country at the time of the elections .,She's traveling because she was out of the country during the election.
環境のために植樹をするという名目であれば 大丈夫だったのです 創造性です,"But if they were together planting trees for the environment , it was okay — creativity .","If it's called planting for the environment, it's okay. Create, honey."
他人任せではだめなのです,And we can &apos;t wait for the other guy . We have to do it ourselves .,We can't leave other people to it.
