sent,reference,translation
手始めにアメリカの ダンサーで試してはどうでしょう,"As a test case , I propose we start with American dancers .","Well, for starters, try American dancers."
今日 どこへ 誰と一緒に行けるかな,Where can I go today and who can I do it with ?,"I don't know where we're going today, or who we're going with."
また映画 「 卒業 」 のひとコマです,Are you guys ready again — &quot; &quot; The Graduate &quot; &quot; ?,I'm a fan of the movie graduation.
むしろ脳の仕組みにおける男女差がわかってきました,And we &apos;re finding more and more gender differences in the brain .,I'm starting to see the difference between men and women in how the brain works.
想像や長期計画に関する脳内経路については知られていますが -,"We now know the brain circuitry of imagination , of long-term planning .",They know about the brain pathways of imagination and long-term plan--
中年期の拡大という現実にも直面しています,So we &apos;re seeing there &apos;s a real extension of middle age .,I'm facing the reality of middle-aged expansion.
そして その波は 光の速さで伝わっていきます,And they travel out into the cosmos at the speed of light .,And that wave travels at the speed of light.
こちらのシミュレーションは NASAのゴッダード宇宙研究所のグループのものです,This computer simulation is due to a relativity group at NASA Goddard .,This simulation was conducted by a group of NASA's Goddard Space Institute.
これは私たちのグループのものです ちょっと豪華さの劣るモデルですが,This is from my group — a slightly less glamorous computer modeling .,"This one belongs to our group, a bit of a fancy model."
比較的軽いブラックホールが 非常に重いブラックホールに吸い込まれる場面です,Imagine a lighter black hole falling into a very heavy black hole .,A relatively light black hole launches itself into a very heavy black hole.
遠く離れたところにある時は,"If it gets far away , it &apos;s a little too quiet .",When you're far away.
幸運にも私たちは遠く離れたカリフォルニアのロング ・ ビーチで,"Luckily we &apos;re at this safe distance in Long Beach , California .","Luckily, we're a long way from Long Beach, California."
安穏としていますが こうしている間にも この宇宙でふたつのブラックホールが,"And surely , somewhere in the universe two black holes have merged .","It's peaceful, but in the meantime, there are two black holes in the universe."
そして そのどちらもの中心に 非常に質量の大きなブラックホールがあると考えられています,And each one probably harbors a super-massive black hole at its core .,And there's supposed to be a very large black hole at the center of either one.
瞑想をしてもお祈りをしても 世界を変えることはないと 思うのです,I do not believe that meditation and prayer will change this world .,I believe that prayers and prayers can't change the world.
アウンサンスーチーと 数日前に話をしました,I spoke with Aung Sun Suu Kyi a couple of days ago .,I talked to Aung San Suu Kyi a few days ago.
彼女は過去1年半に渡って 異郷で暮らしています,She has been in exile for the last year and a half .,She's lived abroad over the last year and a half.
中国にバンジョーを持って行かなければと思い,I knew I had to take a banjo with me to China .,I thought I had to take the banjo to China.
( 音楽 ) &#91; 中国語 &#93; 扉の外には世界が待っている,( Music ) &#91; Chinese &#93; Outside your door the world is waiting .,The world awaits outside the door.
私はあの光の中にいたいと思います あなた方や すべての人と共に —,I want to dwell in that light with you and with everyone .,I want to be in that light with all of you.
しかし 実際はこうなると心がシャットダウンされます,"But all this does , actually , is shut down your mind .","But the truth is, when you do this, your mind will be shut down."
加害者 vs 被害者 といった既存の枠組みを脱却しています,They have broken out of the existing frame of victim and perpetrator .,We're retreating from the existing framework of perpetrators and victims.
真のセキュリティとは死と向きあうことで 目を背ける事ではありません,"Real security is contemplating death , not pretending it doesn &apos;t exist .",True security isn't about facing death.
損失から逃げず 悲しみを受け入れ 降伏することなのです,"Not running from loss , but entering grief , surrendering to sorrow .","Don't run away from loss, accept your grief and surrender."
共有される未来では 単に共有事項となります,"In the shared future , it will be just that , shared .","In the future that keeps being shared, it's simply a shared matter."
子ども達は遊び時間に,"And they use them , in the breaks , for water pistols .",The kids are out of play.
水鉄砲として使い 無邪気に,"They squirt them at each other , which is lovely and innocent .",It's used as a water gun. Innocent.
我々はより良い製品や情報が必要です,So we need a better product . And we need better information .,We need better products and information.
ヒジャブやスカーフを頭に巻くのは 服従の象徴か 、 それとも反抗の象徴なのか ?,Is the hijab or the headscarf a symbol of submission or resistance ?,Wearing a hijab and a scarf on your head is either a symbol of obedience or defiance?
文化を守っている女性と 急進的な運動をしている女性とは,Is it different women who are doing the preserving and the radicalizing ?,A woman protecting a culture and a conservative movement.
そして彼が去った後 、 女性と少女達は後に残りました,"And after he would leave , women and girls would stay behind .","And after he left, the women and the girls stayed behind."
「 カヴィータ ジャン 、 私たちは怖がっている場合ではないわ,"&quot; &quot; Kavita jaan , we cannot allow ourselves to be afraid .","Qyta, Jean, we don't have time to be afraid."
レイマは平和運動家ではなく 、 三人の子の母親でした,"Leymah was not an activist , she was a mother of three .","Lamar was the mother of three children, not peace activists."
翌朝 、 彼女は教会で他の女性達に意見を聞きました,"The next morning at church , she asked others how they felt .","The next morning, she spoke to the other women at the church."
「 全ての男性には ちょっとばかりの贅沢を 生やす権利があるわ 」 と,Every man deserves the opportunity to grow a little bit of luxury .,"""Every man has a right to a bit of luxury."""
十中八九 チャリティーは そのようにして始まります,"Pretty much in every case , that &apos;s how a charity starts .",That's how charity starts.
自分なりの解釈をしてもらうことにしました,We let them embrace it and interpret it in their own way .,I'd like you to give me my own reasons.
圧巻です こうした棚には多種多様の本が 並べられています,And it is amazing the variety that one finds on those shelves .,It's a composite. There are many books on the shelf.
「 子どもを育てる 」 という言葉が 一般的に使われるようになったのは つい最近 1970年のことです,"Parent , as a verb , only entered common usage in 1970 .","The word ""more children"" has been commonly used since 1974."
始まりは 大きな歴史的変化でした,"Well , for starters , there has been a major historical change .",It began as quite a turning point in our history.
これもまた 今どきの子育てを とてつもなく複雑にしている一因です,This is yet another thing that makes modern parenting so very confounding .,This is one of the many things that complicate today's parenting.
世界の変化は速く 予測のしようがありません,"The world is changing so rapidly , it &apos;s impossible to say .",The world is changing fast and unpredictable.
( 笑 ) でも大事なことがあります 男性も たくさんのことをしているのです,( Laughter ) But here is the thing : Men are doing plenty .,But the important thing is that men do a lot of things.
最初に作ったのが 後ろにあるSTriDER Iで,"The first version , in the back , that &apos;s STriDER I.",The first one was made in the back of St. Rider I.
私たちが開発した 超高機動性ロボットIMPASSです,This is a very high mobility robot that we developed called IMPASS .,It's a superconducting robot we've developed.
次のロボットはCLIMBeR 「 ケーブル支持式有足知的適合動作ロボット 」 です,This robot is called CLIMBeR : Cable-suspended Limbed Intelligent Matching Behavior Robot .,"The next robot will be CLASHbear, a cable-operated, foot-activated motion-activating robot."
すごく面白いものをご覧に入れましょう,"And also , it does some fun stuff , as can imagine .",Let's see something really interesting.
弾性のある表面に位置エネルギーを蓄えて移動したり,We store potential energy to the elastic skin to make it move .,We store energy in position on bulletproof surfaces.
お次は新しいロボットのRAPHaELです,This robot is a very recent project . It &apos;s called RAPHaEL .,"And now for the new robot, MarinajaEL."
私たちはこの問題に別な方向から取り組みたいと思いました,We wanted to go tackle this problem in a very different direction .,We wanted to look at this matter in another light.
そもそも可能なのか ? どのような制御が必要になるか ?,Is it even possible ? What kinds of controls should we do ?,What kind of control do you need?
RoboCupという大会があります,"Dennis Hong : So , there is actually a competition called RoboCup .",There's a competition called KehCup.
ご存じの方がどれくらいいるかわかりませんが,I don &apos;t know how many of you have heard about RoboCup .,I don't know how many of them you know.
まだまだお話ししたいエキサイティングなロボティクスプロジェクトがたくさんあります,"And many , many other robotics projects I want to talk about .",There's a lot of exciting robotics projects to talk about.
後ろに出ている写真は午前3時のラボの様子です,This picture in the back this is 3 a.m. in the morning .,The photograph at the back was taken from the lab at 3:00 a.m.
ワインを注文して ウェイターに断られたことは ?,Or had a server refuse to bring you a glass of wine ?,Have you ever ordered a bottle of wine and the waiter said no?
男性の問題でも 女性の問題でもなく,This is not a men &apos;s problem or a women &apos;s problem .,It's not a man. It's not a woman.
皆さんは読んだことが ありますよね ?,"You guys have read &quot; &quot; Don Quixote , &quot; &quot; yes ?",You've all read it.
よろしいですか ? お名前は ? グウェンですね,Can I ? Would you ? What is your name ? Gwen .,What's your name?
あなたの名前はスクラブルでは 8ポイントだって知ってました ?,Did you know that your name is worth eight points in Scrabble ?,Did you know your name was eight points in Schirach?
( グウェン ) 青ね ( デビッド ・ クォン ) 青 そう青です,"Gwen : Cobalt . David Kwong : Cobalt , yes . Cobalt .",They're really blue.
タングラムをお見せした時には 緑のニワトリがいました,And then we played a game of tangrams with an emerald rooster .,"When I showed you the tangier, there was a green chicken."
そうそう もう1つありました,"Oh , and there &apos;s one more , there &apos;s one more .","Yeah, yeah. There was one more thing."
では もう1つの パズルのピースを ご覧ください,Now let &apos;s take a look at another piece of the puzzle .,"Now, let's take another piece of the puzzle."
これから映画のクリップをお見せします,So I want to show you a clip of the film now .,I'm going to show you a clip of the film.
私たちはこれを3つに分けました,So we had three main areas that we had to focus on .,We made this male into three pieces.
えくぼ 大きなしわから小さなしわまで全ての情報が必要でした,We needed creases and dimples and wrinkles and all of those things .,Uh-huh. I needed all the information from big to small.
これが私たちの研究のベースになりました,So this became the foundation of our research as we went forward .,This is the base of our research.
けれど私たちはポリゴンの観点から 複雑かつ信憑性のあるデータ測定をしました,We measure complexity and fidelity of data in terms of polygonal count .,But we did complex and reliable data readings from Polygon point of view.
左側では10万ものポリゴンが見えました,"And so , on the left , we were seeing 100,000 polygons .","On the left side, I saw 100,000 polygons."
次は現在の彼の年齢に40年を加算する作業です,We need to put another 40 years on him at this point .,Now we're going to add 40 years to his current age.
こちらでは選ばれたテイクがお見えですね,"And so here , you can see again , the chosen take .",This is where you'll find the chosen take.
発話時の舌の動き全てを記録したシステムも作りました,There was a whole system written in software to articulate the tongue .,I also created a system that recorded every movement of the tongue when the call was made.
舌の動きだけに約9ヶ月専念してくれた人がいて,We had one person devoted to the tongue for about nine months .,Someone's spent about nine months focusing on the movement of his tongue.
セクシーですらりと長身で褐色の肌,"She &apos;s sexy , slim and tall , with a deep tan .","She's sexy and tall, and has brown skin."
ジェニーにはその資格も経験もありません,She &apos;s not licensed for that ; she has never done it .,Jenny doesn't have your qualifications or experience.
目がどこにあるかもわかりません,It is so swollen that you can &apos;t even see the eyes .,I don't know where my eyes are.
なのに この明白な事実は政府や 慈善団体にも無視されています,Yet this obvious truth is ignored by governments and also by philanthropy .,And yet this obvious fact has been ignored by governments and charities.
男が世界を操り その結果がこれです,"Men run the world , and look at the mess we have .","A man manipulated the world, and this is the result."
不正は梯子の上から下まで浸透します,Abuse trickles down from the top of the ladder to the bottom .,"Oh, corruption permeates from top to bottom."
下底にいるのは女と子ども 特に貧民,"Women and children , especially the poor , are at the bottom .","The women and children are downstairs, especially the poor."
家族や地域共同体の 生活を賄うための仕事 ?,Was it working to provide food for a family or a community ?,"A job to feed family, community community?"
生活や資産を守るために 日夜働いたこと ?,Was it working days and nights trying to protect lives and property ?,You work day and night to protect your lives and possessions?
色や光 、 表面の感じ 、 化学成分 、 pHを 検知することができます,"They can sense color and light , textures , chemicals , pH .","It senses color, light, feels on the surface, chemical components, compositions."
しかし私の研究は過去の経緯を 調べることではなく,"But in my research , I &apos;m not interested in looking backward .",But my research was never about looking into the past.
これが初めて目にした ハシラサンゴの赤ちゃんです,So this is the first pillar coral baby that anyone ever saw .,This is the first child I've seen in my life.
サンゴに何十兆円の価値があることは ひとまず忘れましょう,So never mind that they &apos;re worth hundreds of billions of dollars .,Let's just forget it's worth billions of yen.
叔父さんはコンドームを買います 良くできました 一マス進む,"Uncle buys a condom . Very good , uncle . Move ahead .",My uncle buys condoms. Well done. There you go.
"35 , 36年経った今でも このプログラムは続いており","And after 35 / 36 years , it &apos;s still going on .","35, 36 years later, this program goes on."
みんなで協力して 行動や習慣を変えることができるのです,But it &apos;s everybody &apos;s job who can change attitude and behavior .,"We can work together to change our minds, change our habits."
残念なことに 政府は拒否するのみだったのです,"But unfortunately , the government was in denial , denial , denial .","Unfortunately, the government simply refused."
メディア関係者も HIVに関する教育が必須となったのです,"And here , every media person had to be trained for HIV .",The media is in desperate need of an education on the subject.
努力は報われるのです,"So it just showed you , you could do something about it .",The effort is rewarded.
「 もう ここでは靴や服を作るのは止めるべきだ,"They said , &quot; &quot; They should stop making shoes and clothes .",Don't make shoes or clothes here anymore.
スターバックスはあなたの目を覚ましますが 我々はそれだけでなく命を守ります,"See , Starbucks you awake , we keep you awake and alive .","Stuart will wake you up, but we'll save lives, not just for it."
竹でできた建物があります 竹だけでできています,And here is a bamboo building — all of them are bamboo .,"There's a building made out of fireflies, but only fireflies."
またある種のホタルでは メスだけが蛍光を放ちます,"In other fireflies , it &apos;s only the females who light up .","And in some fireflies, only females glow."
なおもそのオスが お気に入りならば 二人は会話を始めます,"If she still likes him , they &apos;ll strike up a conversation .","By the way, if that male is your favorite, they'll start a conversation."
では光が消えたときに 何が起こるか見てみましょう,Now we get to see what happens when the lights go out .,Let's see what happens when the light goes out.
交尾するつがいの内部を 更に拡大して観察してみると,We can zoom in to look more closely inside this mating pair .,I'm trying to zoom in on the internal mechanics of interbreeding.
愛を求めているのではありません 毒素が目当てです,She &apos;s not looking for love : she &apos;s looking for toxins .,I'm not here to seek love. I'm here for the toxin.
蛇 : 食べちまいなよ 、 アダム イヴを見捨てるのか ?,"&quot; One bite , Adam . Don &apos;t abandon Eve . &quot;","Don't eat it, Adam."
もちろんマシュマロが好きなら 、 待つ甲斐がある,"Of course it pays , if you like marshmallows , to wait .","If, of course, you like marshmallows, you have every right to wait."
自然によるリサイクルシステムは10億年前からあり,This recycling system has been in place for the last billion years .,The primal recycling system has been a billion years old.
素材を育てていますと何度も言いましたが,So I &apos;ve said a number of times that we grow materials .,I've told you again and again that you're growing material.
私たちがやっているのは 帆走技術の進歩を 加速させることです,So what we are doing is an accelerated evolution of sailing technology .,What we're doing is accelerating progress in sailing technology.
本当に必要な姿は逐次的でも 並行的でもありません,"What you really want is not a sequential , not parallel development .",Wasn't a single thing you really needed.
私が聞いたことのないものまで,And other things that I don &apos;t — aren &apos;t familiar with .,Something I've never heard.
その時紹介したのが当時画期的とされた義足,"At the time , the legs I presented were groundbreaking in prosthetics .",That's when I introduced you to the groundbreaking urban footage of that time.
義肢はもはや失ったものを補うのではない,A prosthetic limb doesn &apos;t represent the need to replace loss anymore .,A synthetic inheritance doesn't make up for the lost anymore.
目隠しで何も見えませんよね ?,"Kathryn , there was no way you could see through that blindfold .","You can't see anything in the blindfold, can you?"
何か障害物はある ?,"KB : Now , anything coming at all ? KT : No .",What's the problem?
拍手でお迎えください,"OK , give them a round of applause as they come up .",Could you give a round of applause!
彼の名前にはKが入ってる,"There &apos;s a K in his name , there is a K.",His name's K.
ヘロイン 、 コカイン 、 売春組織へ流れて行く女性たち そして貴金属,"Heroin , cocaine , women being trafficked into prostitution and precious minerals .","Heroin, cocaine, prostitutes and precious metals."
いやはや 、 それでどれほどマネーロンダリングが やりやすくなった事か,"And boy , did that make it easy for the money launderers .",I don't know how easy it is to launder money.
この20年間は 、 汚い金儲けには大盤振る舞いの 時代でした,The last two decades have been the champagne era for dirty lucre .,These last 20 years have been a big game for dirty money.
しかしこの中心には 、 オフショア銀行のネットワークがあります,"But at the heart of this , is the offshore banking network .","But at the center, there's an offshore bank's network."
国際犯罪の入門クラスをやりましょう,Let me go on to the 101 of international organized crime now .,Let's do an international crime entrance class.
組織犯罪はすでに不況に対する 用意が十分にできているようです,"Well , organized crime has already adapted very well to the recession .",The organized crime syndicate is already ready for recession.
これはあるブラジル人のサイバー犯罪者から紹介されたキットで,I was introduced to this bit of kit by a Brazilian cybercriminal .,This kit was introduced by a Brazilian cyber criminal.
ほとんどの場合 私たちは自分で 科学的主張を評価することはできません,We can &apos;t really judge scientific claims for ourselves in most cases .,"In most cases, we can't appreciate our own scientific claims."
理想的な場合 法則が関わるせいでもあります,"But also because in the ideal case , it &apos;s about laws .","In ideal cases, the law favors it."
もしそれが自然の法則なら 絶対だからです,"Because if it is a law , it can &apos;t be broken .","Because if that's the law of nature, it's final."
こちらは年周視差として知られる 概念の説明です,And so this slide here illustrates a concept known as stellar parallax .,This is the explanation for the concept known as the tree's radius.
実は ここに描かれているよりも ずっと小さいんですよ,"In fact , it &apos;s actually much smaller even than shown here .","Actually, it's a lot smaller than what's written here."
つまり科学的知見は 専門家の総意だと考えられます,So we can think of scientific knowledge as a consensus of experts .,"I mean, it's conceivable that scientific knowledge is the will of an expert."
( 笑 ) さて では私の最後の論点です,"( Laughter ) Okay , so that brings me to my final point .","Okay, here's my final argument."
私たちが日常生活で使うモノは,There are an enormous number of them that we use every day .,What we use in daily life.
それでコンピュータを使うというのではなく,"Rather than using it for my computer , I actually opened it .",It's not just about using a computer.
壁の前で立ち止まって投影します,"You stop by a wall , and start painting on that wall .",- in front of the wall.
手のひらでダイヤルしているところです,"Here , I &apos;m dialing a phone number just using my hand .",I'm closing in on him.
率直に言うと これが私の 出発地点でもあったように思います,"And I think , quite frankly , that &apos;s where I started .","Frankly, I think this is my point of departure."
ですから 両方から引っ張られているような感じです,So there &apos;s this thing that is pulling me in both directions .,So it's like you're pulled from both sides.
爆弾で破壊された風景のように 見えますが そうではありません,"And it looks like a bombed-out landscape , but it isn &apos;t .","It looks like burnt out by a bomb, but it's not."
巫山といい 移転された都市の中で 最大のもののひとつです,"This is Wushan , one of the largest cities that was relocated .",Ulsan is one of the biggest relocation cities in the country.
この写真には熔鉱炉が3つ写っています,So this is three of the visible blast furnaces within that shot .,This is a photograph of three agitation furnaces.
これは石油の副産物であるレーヨンを使った織物工場です,"This is a textile mill doing synthetic silk , an oil byproduct .","It's a textile factory using rayon, a by-product of oil."
( 拍手 ) 願い事を2人の娘に捧げたいと思います,( Applause ) I want to dedicate my wishes to my two girls .,I'd like to offer my well wishes to my two daughters.
