sent,reference,translation
捜索や救助のような用途にも使えるでしょう,Also for search and rescue applications as well .,You can use it for search and rescue.
ラボを見学しに来る人はたくさんいるのですが,We get so many visitors visiting our lab .,There's a lot of people who come to see the lab.
このような地形を よじ登ることができます,This is a robot that can climb structures .,I can climb this ladder.
いかしているのはユーザインタフェースの部分です,But the cool part is the user interface .,It's the fleeting part of the IV.
これにはまだセンサーがついていません,"So , this does not have any sensors .",The sensors aren't on yet.
開ループ制御です,"So , it &apos;s an open loop control .",Open loop control.
国際的な自律ロボットによるサッカー競技会です,It &apos;s an international autonomous robot soccer competition .,It's an international soccer competition of robot boxing robots.
2008年は中国で行われました,"So , this is last year in China .",It was purposely conducted in China.
DARwInは他にもたくさんの才能があります,DARwIn also has a lot of other talents .,CNwin has many other talents.
どうやって考え出しているのか ?,Where do we come up with these ideas ?,How did you come up with that?
どうやってアイデアを発展させているのか ?,How do we develop these kinds of ideas ?,How do you evolve your ideas?
秘密は5つあります,"So , really , we have five secrets .",There are five secrets.
まずどこからインスピレーションを得るか,First is : Where do we get inspiration ?,"First, you need to know where you get your inspiration."
イマジネーションの閃きをどうやって得ているかです,Where do we get this spark of imagination ?,It's how you get imagination recalls.
そのようなアイデアをどうやって発展させるのか ?,How do we develop these kinds of ideas ?,How can such ideas be improved?
そうやってアイデアを発展させるのです,And this is how we develop our ideas .,That's how we get our ideas to grow.
これらは私たちが必要とするツールなのです,These are all the tools that we need .,These are the tools we need.
以上です どうもありがとうございました,There you go . Thank you so much .,That's all. Thank you very much.
「 へえ もっと教えてよ 」,&quot; Oh . Tell me more . &quot;,"Oh, tell me more."
分娩をどうするかなどと 踏み込んだ質問をされたことは ?,Or asked private questions about your birth plan ?,Have you ever been asked questions about how to split up?
生まれた時から 謎を解くように出来ているのです,"From birth , we are wired to solve .","From the moment they were born, they were designed to solve riddles."
発明された こちらのパズル — ジグソーパズルはどうでしょう,invented in 18th-century England : the jigsaw puzzle .,"What about the puzzle that was invented by us, a jigsaw puzzle?"
カオスから秩序を 作っているでしょう ?,Is this not making order out of chaos ?,"You're building order from chaos, aren't you?"
世界を解読しようと しているのです,We are always trying to decode our world .,I'm trying to decode the world.
急に みんな目をそらしましたね,Everybody &apos;s looking away all of a sudden .,"All of a sudden, people have looked away."
私はこちらにいます,But I &apos;m going to go over here .,I'm here.
まあ これでもいいでしょう,"This is still going to work , though .","Well, that's good."
よく探して 椅子の下に隠してあります,Really dig . We hid them under there .,Keep looking. It's hidden under the chair.
上に名前があります,You can see my name above the grid .,There's a name upstairs.
( 拍手 ) すごいでしょう ?,"( Applause ) That &apos;s pretty cool , right ?","That's amazing, right?"
人間はカオスの中に 秩序を見出します,We &apos;ve all made order out of chaos .,Humans find order in chaos.
若返っていく僕をみんなはどう思う ?,but I was getting younger than everybody else ?,What do you think folks think of me getting younger?
持病を持って生まれたんだ ―,I was born with some form of disease .,I was born with a condition.
完全なるCGの顔を作りあげました,We &apos;ve created a completely digital human head .,I've created a perfectly good face.
ベンジャミンは多くの共感を呼ぶ人物でなければなりません,He needed to be a very sympathetic character .,Benjamin must be someone who brings a lot of sympathy.
5週間ほどにわたって行われたのですが -,And we did it in about five weeks .,It's been going on for about five weeks.
たくさんのズルや近道をしました,But we used lots of cheats and shortcuts .,I've done a lot of cheating and shortcuts.
こちらがその役者の方です,So these are the gentleman who played Benjamin .,This is the actor.
そしてこちらが体を演じる俳優の演技,And here you can see the body actor .,And this is the performance of the actor playing the body.
そしてもう一度完成した映像です,"And then , again , the final shot .",And now it's done one more time.
それから目に特化したシステムも作り出しました,We also had to create an eye system .,And then I created a system that specializes in eye contact.
それから口に特化したシステムも必要でした,We also had to create a mouth system .,Then we needed a more evolved system.
時と共に歯にも変化を加えました,We had to age the teeth over time .,"And as time went on, the teeth changed."
笑顔は笑顔でしかないわけで,So it sees a smile as a smile .,A smile is nothing but a smile.
これがベンジャミンです ありがとうございました,"But , that is Benjamin . Thank you .",This is Benjamin. Thank you.
自分の知る事を書け そう言いますね,"Well they say , write what you know .",Write down what you know.
私は旗をより一層元気に振り,And I wave my flag even more vigorously .,I'd wave to the flag more wisely.
ええ 私は何の病気も治りませんでしたが,"Well , I wasn &apos;t cured of anything .","Yeah, I didn't heal any disease."
それが女王の権利であるように 私の権利でもあります,It &apos;s my right as much as hers .,"Just as is the queen's right, it's my right."
ご清聴ありがとうございました,Thanks very much for listening to my song .,Thank you for your attention.
ありがとうございます ( 拍手 ) ありがとう,Thank you . ( Applause ) Thank you .,Thank you.
簡単です 一緒に歌いましょう,It &apos;s very easy . Sing in unison .,It's easy. Let's sing together.
♪ SOSを送ろう ♪ さあ歌って,♪ Sending out an S.O.S. ♪ Come on now .,"♪ Let's send them a smoke. ♪ Come on, sing."
私が大好きなユダヤの諺があります,There &apos;s a Jewish saying that I love .,There's a Jewish formula that I love.
ここにいる方たちのようにね,People like all of you in this room .,Just like everybody here.
控え室ではユニフォームを渡されました,In the green room I received my uniform .,He gave me a uniform in the booking room.
ソフィアは70歳を超えるのに容姿端麗です,Sophia is over 70 and she looks great .,Sophia even looks way better than 70 years old.
スワヒリ語でマペンドは大いなる愛を意味します,"Mapendo , in Swahili , means great love .","In Lower Swahili, the Muppet means great love."
本にしたい人はたくさんいますから ...,I look around and I see them everywhere .,There's a lot of people dying to write a book.
彼女は怯えながらもリスクを冒します,She risks a lot and she &apos;s terrified .,She's too scared to take the risk.
彼女の顔はスイカのように腫れあがり,The woman &apos;s face looks like a watermelon .,Her face was swelling up like a watermelon.
ワンガリ マタイがケニアの村へ行き,Wangari Maathai goes to a village in Kenya .,That's right. Matthew went to a village in Kenya.
私が一番危惧するのは迫害です,What I fear most is power with impunity .,What I'm most worried about is the abuse.
より良くではなくて 良くしたいのです,"Not better , but to make it good .","I don't want to be better, I want to be better."
子供時代は そんな疑問で溢れていました,My childhood was abound with questions like this .,"When I was a child, I was so filled with these questions."
暗闇で走り回ったりしてはいけない,You can &apos;t run around in the dark .,You can't run around in the dark.
この増加率を下げなければなりませんでした,We needed to reduce the population growth rate .,I should have focused this growth rate.
この写真は国中でニュースになりました,And this picture was sent throughout the country .,This photo became on the news all over the country.
もちろん アメリカのコーラ,"Of course , it must be American cola .","American Coke, of course."
コークとペプシ どちらもあるよ,"You get two brands , Coke and Pepsi .",I've got a Coke or Pepsi.
そして 次の段階に移ることになりました,And then we went down one more step .,And it was time to move on to the next level.
あとで差し上げようと思いますが,But I have some to give out afterward .,I'll give it to you later.
次のオリンピックが命を守るものでありますように,And let the next Olympics save some lives .,May the next Olympics protect lives.
誰もが参加するようになりました,"After all this time , everybody joined in .",Everybody participates.
資金の90 % はタイ国内から出ています,90 percent of the funding came from Thailand .,90 percent of the funds came from Thailand alone.
資金を得られることは 人権のひとつであるはずです,Access to credit must be a human right .,It should be one of the human rights to get funds.
そうでなければ 人々は貧困から脱することはできません,Otherwise they &apos;ll never get out of poverty .,"Otherwise, people can't get away with it."
「 学校を利用した地域開発 」 と称しています,We call this our School-Based Integrated Rural Development .,It's called a regional development for the schools.
竹でできたジオデシックドームです,This is a geodesic dome made of bamboo .,It's a cast-of-the-moment reactor.
光が消えた後はどうなるんだろう ?,And what happens after the lights go out ?,What happens after the light goes out?
ホタルは成長の過程で 体をすっかりと作り変えてしまいます,Fireflies completely reinvent their bodies as they grow .,"When they grow, fireflies change their bodies completely."
ホタルの光は この幼少期に始まっています,And firefly light first originated in these juveniles .,The firefly's light begins in my childhood.
空を舞い全力を振り絞って 光を放っています,They &apos;re flying and flashing their hearts out .,♪ Above and beyond ♪ ♪ Above and beyond
ところで メスたちは何処にいるのでしょう ?,"But meanwhile , where are all the females ?","Where are the females, by the way?"
するとオスは近づいて光を今一度放ちます,So he flies closer and he flashes again .,And the males will approach and release the light once more.
ではメスはオスの性的魅力を 何で測るのでしょう,So what exactly do these females consider sexy ?,So how does a female measure the sexuality of a male?
甘美だとか 輝かしさだけでは ないのですね,So it &apos;s not all sweetness and light .,Maybe it's sweet. Maybe it's radiant.
アダム : わからないよ,"&quot; &quot; I don &apos;t know , guys .",I don't know.
過去のポジティブ 、 あるいはネガティブに集中できます,"You can focus on past-positive , or past-negative .",You can focus on the past positive or negative.
過去-ポジティブが高く 、 未来にはやや高め,High on past-positive . Moderately high on future .,"Higher in the past, higher in the future."
更にこの物質は梱包以外にも使われています,And this isn &apos;t just found in packaging .,"Furthermore, this substance is used anymore than packing."
さてここでキノコに話が繋がります,And this gets us back to the mushrooms .,"Well, here's what we can talk about, mushrooms."
従来の農作に比べたら遥かに早いです,But it &apos;s much faster than conventional farming .,It's much faster than the traditional crops.
イノベーションの ネットワークです,You want to have a network of innovation .,It's an invert network.
マシュー ・ バーニーの 「 クレマスター ・ サイクル 」 が,I learned this firsthand with my next adventure .,"Matthew Bernie's ""Clears cycle."""
これが拡大画像,That &apos;s a good close-up of that one .,Here's the enlarged image.
何か感じた ?,"Yes or no , did you feel anything ?",Did you feel anything?
今回は動きましたね,"OK , it worked that time , excellent .",You made a move this time.
二人とも そのままで,"And hold it there , both of you .",You two stay put.
紙コップの位置を教えてください,Tell me when I &apos;m over a cup .,Tell me where the paper cup is.
つまり警察が機能しなかったということです,That means your police force wasn &apos;t working .,Which means the police weren't functioning.
つまり我々の言うマフィアにです,We prefer to know them as the mafia .,That's what we call the mob.
しかしコンゴ民主共和国ではどうか ?,But what about the Democratic Republic of Congo ?,But what about the Democratic Republic of Congo?
それは国際的な金融市場の自由化です,It was the liberalization of international financial markets .,It's the freedom of an international financial market.
私たちの通信や年金基金に影響するのです,"They affect our communications , our pension funds .","It affects our communications, our pension funds."
ここでお話しできたのは光栄です,It &apos;s been a privilege talking to you .,It's a pleasure to meet you here.
科学者は世界が温暖化していると 言いますし,Scientists tell us that the world is warming .,Scientists say the world is warming up.
ほとんどの化学者は 進化論の専門家ではありません,Most chemists are not experts in evolutionary theory .,Most chemists aren't physicists.
なぜ彼らは お互いの主張を信じるのでしょう,Why do they believe each other &apos;s claims ?,Why would they trust each other's claim?
これが理論を立証する決め手となりました,This was a huge confirmation of the theory .,This is the tricky thing to prove the theory.
つまり法則が関係しているということです,So nomological means having to do with laws .,Which means the law has something to do with it.
そしてその関係は どんな時も必ず成り立ちます,And that relationship is true no matter what .,And that relationship always happens.
主な問題は それが間違っているということ,The main problem is that it &apos;s wrong .,The main problem is that it's wrong.
まずは論理上の問題,So the first reason is a logical reason .,It's a logical matter first.
そうではありませんでした,And that turned out not to be true .,"No, it wasn't."
この黒い線が現実です,So here is the real life in black .,This black line is real.
科学者は 「 Yes 真である 」 と言うこともあれば,"Scientists can say yes , something &apos;s true .","Sometimes scientists say, ""Yes."""
「 No 偽である 」 と言うこともあります,"Scientists can say no , it &apos;s false .","The word ""no"" means ""no."""
権威とは科学界全体のことです,It &apos;s the authority of the collective community .,Power is the entire science world.
大抵の人は朝起きて,Most of us get up in the morning .,Most people wake up in the morning
カメラがジェスチャーを捉え,The camera is actually tracking all your gestures .,The camera located the gesture.
しかし 我々はこれらの時代から 完全に切り離されてしまいました,But we &apos;ve become totally disconnected from them .,But we have been completely cut off from these times.
このような新しい技術に 我々は期待を寄せています,And we all look forward to those things .,We're expecting a new technology like this.
これが市庁舎です,This is the town hall for the city .,This is city hall.
タキシードや花束が描かれています,"You &apos;re seeing the tuxedos , the bouquets .",There are tuxedos and flowers painted.
国内会社はそれに比べて簡単でした,But the domestic was much easier to do .,The domestic company was easier than that.
約14ヶ月前に始められたばかりなのにです,And it just started about 14 months ago .,It was only started about 14 months ago.
こうすれば化石燃料に頼らなくて済みます こうすれば化石燃料に頼らなくて済みます,We don &apos;t borrow any energy from history .,"This way, we won't have to rely on fossil fuel."
エネルギー依存も なくなるわけです,We are not borrowing energy from our neighbors .,You'll be less addicted to energy.
私の方を見て微笑んでいる男,A man who turns towards me and smiles .,A man who smiles at me.
そして ある晩 シーンが変わったの,"Then , one night , the scene changes .","And then one night, the scene changed."
猫や犬が寄ってきて,I see cats and dogs walking towards me .,Cats and dogs are generally attracted to me.
彼女の言うとおりにしました,"Well , so I did tell the nurses .",I've done what she says.
徐々に現れたり消えたりしません,They don &apos;t usually fade in and out .,He doesn't show up or disappear.
映像を繰返し見ることは 反復視と呼ばれます,This repetition of perception is sometimes called palinopsia .,It's called this iteration.
2つ目によくあるのはアニメ,And one of the second commonest is cartoons .,"Secondly, it's very common."
“ カーミットなんて私にとって何の意味も持たない ”,&quot; Kermit means nothing to me . &quot;,RICHIE: Kermit could mean nothing to me.
不安にかられませんか ?,CA : And they don &apos;t disturb you ?,Wouldn't that make you nervous?
聴衆 : 折りたたむ スミス : 皆さん大きな声で,Audience : Fold . JS : Really loud .,"Ladies and gentlemen, louder."
さすがに再生紙では ダメだとお考えの方にも ...,If you think this isn &apos;t as good ...,Even if you think you can't do it on the front page...
経験した中で最低の気温です,It was the coldest I &apos;ve ever been .,It's the worst temperature I've ever seen.
( 会場から 「 イエス 」 ) ありがとう,Audience : Yeah . JY : Thank you .,Thank you.
説明させてください,But let me explain what I &apos;m thinking .,Let me explain.
社会保障にも医療保険にも賛成していますし,They like Social Security . They like Medicare .,"I agree with social security, medical insurance."
これは大きな間違いです,But that is not the case at all .,This is a big mistake.
約4分の1が共和党でしょう,Around a quarter say that they are Republicans .,About a quarter of the democrats are Republicans.
これは現在も変わらぬ傾向です,And that part of it has not changed .,It's a groundswell.
でも決して 私たちの考えを 代弁しているわけではないのです,They don &apos;t represent what our views are .,But you're never representing what we think.
ハミルトンとジェファソンの論争と 同じことです,We had the battle between Jefferson and Hamilton .,It's the same argument past Hamilton and Jefferson.
恐ろしいのは世界がこれを見ていることです,The fear is that the world is watching .,What's scary is that the world sees this.
処方箋を支払う為の保険は ?,Do they have insurance to fill the prescription ?,Are you insured to pay for a prescription?
私たちはどうすべきなのでしょうか ?,What are we going to do about it ?,What should we do?
そのように教え込まれても来た,We &apos;ve been schooled in them as well .,That's what I was taught.
私はこう答えます 「 ええ ! ? 本当に ?,"And I &apos;m like , &quot; &quot; Really ?",I don't know.
挨拶したりするでしょう,And you &apos;re nice . You say hi .,He'll say hello.
彼らは才能ある科学者 、 芸術家 、 作家達だったり,They are incredible scientists and artists and writers .,"They're gifted scientists, artists, writers."
ジョン 物はそれぞれ目的を持って 使う人を考えて作られるべきだ,"Every object should be about something , John .","John, each thing has to be made for a purpose, and son."
父はやる事全てにデザインを取り入れました,And design was in everything my dad did .,My father applied design to everything he did.
それをどう演奏するかが大切だ,It &apos;s how you cover it that matters .,It's important how you play it.
スイスイと空港内を動いても,"I roll swiftly through an airport , right ?","Even if we move within Switzerland and the airport,"
我々は意図を持って デザインを意識して 行動することになっているのです,We &apos;re supposed to do things by design .,We're supposed to work on design.
( 笑 ) これは気が楽です,( Laughter ) What a liberating thought ! Yes !,I'm relieved.
きっとそれが原因かもしれません,"In fact , maybe that &apos;s the problem .",Maybe that's why.
私の遭った事故のようなものですね どこからともなく やってきたのです,"It &apos;s something like my accident , right ?",It's an accident I've been through. It's come from nowhere.
キンシャサの中心で暴動が起こり,There was rioting in the middle of Kinshasa .,There was a riot in the center of Kinshasa.
皆さんにもお見せしたいものです,I wish I could show you that contraption .,Let me show you something.
私のは アメリカ製のしっかりした 洗練されたデザインです,"My machine : American-made , confident , sleek .","I'm an American made, sophisticated design."
きっと喜んだと思います きっと解ってくれたと思います,He would have loved those ! Oh yeah .,I'm sure he was happy. I'm sure he understood.
そんな中でしばらくデザインの事しか 目に入りませんでした,Design blew it all away for a moment .,All I could think of was design for a while.
2週間後に警察官が彼らを止めました,"Two weeks later , the police stopped them .","Two weeks later, the cops stopped them."
彼らは市の法定代理人のオフィスを訪れました,They came to the city attorney &apos;s office .,They visited the mayor's office.
単純に撮れませんでした,We simply couldn &apos;t capture it on video .,I couldn't get a clear shot.
そして最初の驚きに出会いました,And we were in for our first surprise .,And I have encountered the first surprise.
筋肉は収縮しますが何も起きません,"So the muscle contracts , and nothing happens .","The muscles should be atrophied, but nothing will happen."
これは私を本当に悩ませました,And that was what really got me puzzled .,This is really bothering me.
そこに注目してみてください,Pick up a place and focus on it .,That's what I'm talking about.
大学教育は高価です 我々は皆それを知っています,Universities are expensive . We all know it .,College education is expensive. We all know that.
私たちは ― ( 拍手 ) ― ありがとうございます,We — ( Applause ) — Thank you .,Thank you.
私たちは全く新しいものを 考え出す必要はありませんでした,We didn &apos;t need to reinvent the wheel .,We didn't have to think of anything completely new.
通常の大学は バーチャルな大学には必要のない 支出をしなければならないのです,Universities have expenses that virtual universities don &apos;t .,"Uh, normal colleges have to do things that virtual colleges don't need to do."
それは5年前には 未来像でした,"Five years ago , it was a vision .",It was a future form five years ago.
「 ユニバーシティ ・ オブ ・ ザ ・ ピープル 」 は 今や完全に認証されたのです,University of the People is now fully accredited .,The University of the People's Front has now been booked and authenticated.
この画像は完全に間違っています 完全に違います,"This image is totally incorrect , totally incorrect .",This footage is completely wrong. It's completely wrong.
だからこれを もっと追及したいと思いました,So I wanted to seek this out further .,That's why I wanted to keep track of this.
オスが出産する 驚異的な生物です,"The males give birth , just phenomenal creatures .",It's an extraordinary creature on which the males give birth.
( 音楽 ) 彼らは最も謎めいた魚です,( Music ) They &apos;re the most cryptic fish .,They are the most mysterious fish.
でも これはサメにとって どんな意味があるのでしょうか ?,But what does it mean to the shark ?,But what does this mean to a shark?
スペクトル線から 銀河の組成を推測します,"From spectral lines , the composition of nebulae .",I'm guessing the intersection of intersections in intersections.
