sent,reference,translation
彼が死ねば その価値は 天井知らずに上がるわね,"He dies, the prices go through the roof.","If he dies, it'll be worth more than the ceiling."
それができて ぼくは天狗になった,"And then, when I finally got there, it wasn't me anymore.",That's what made me a jerk.
当然だと思うよ。 それで 天狗になるわけでもなく。 性格もいいし アイデアも 豊富だし。,"And you're not stuck up about it, you have a good personality, and tons of good ideas, you work really hard.","I think it's obvious, and it doesn't mean you're a jerk, but you have a good personality and a lot of ideas."
傭兵では太刀打ちできない,They'll beat any mercenary army.,The mercenaries can't beat them.
For there's no man in town half as manly 誰も太刀打ちできない,For there's no man in town half as manly,For there's no man in town half as manly
警察も太刀打ち出来ない,"Maybe way beyond them, too.",The cops can't beat it.
太鼓を叩いて道路を行進して旗をなびかせる,You march down the road banging drums and waving banners?,"They're going to wave along the road, wave the flags."
先月衛生指導員が来て 太鼓判を押して帰った,"Look, we had the county health inspector here last month, and he gave us perfect scores.","Last month, the health teacher came by and pushed his ears off."
わが社も彼に 太鼓判を押すよ,"And the way I feel, my company will underwrite him anytime.",We're going to give him a chance.
しかし、愛のために全てを 放棄した頭のいい女性は、 必然的に自分自身を 見つめ奈落の底へ、 男性や、赤ちゃんでは、 単純に埋められない。,"But a woman with brains who gives up everything for love inevitably finds herself staring into an existential abyss that men, babies and cardio bars simply cannot fill.",But a smart woman who has abandoned all of her love is desperate to look herself to the bottom of a fall that men and babies can't simply bury.
奈落の底まで突き落とされるわ,You will end up at the bottom of a hole.,They're going to push you to the bottom of the fall.
司祭の前で契りを結び,We say our vows in front of the high septon.,We'll join hands in front of the priest.
- それは血で兄弟の契りを結んだんだ,It was a Blood Pact! Like brothers!,- It was blood. It was blood. It was blood.
奥行きがない!,- Depth! I'm lacking depth!,There's no way in!
ケンカしても始まらない,Come on. Now we're not gonna get anywhere fighting.,You can't start a fight.
さっさと立って 外で始末を 付けようじゃないか,"You're gonna get up, and we're gonna settle this outside.",Why don't we just stand up and clean up outside?
安心しな 刑事さん 俺にエディを殺った奴の 始末を付けさせれば− 手間をかけない,"Rest assured, Detective, if I find the person responsible for Eddie's murder, you'll never know.","Don't worry, Detective, if you let me take care of Eddie's killer, it won't be too much trouble."
始末を付けるに十分な,We could pay you to have it cleaned up.,Enough to get rid of it.
やつらが姑息な手を使って 隠した事実さ,They use static electricity to... to mask the changes.,It's the fact that they hid it with their sleazy hands.
俺と向き合ったらどうだ 操り人形で 姑息な手段を使わないで,"Face me like a real man, not with your hand up another's ass like a bloody puppet.","Why don't you just face me, a doll, and not use your slightest breathing."
姑息な連中だよ,"Even for this group, that takes nerve.",They're so full of life.
知ってる? 人生、姿勢を正して真直ぐ 立てと言われた続けた,"Do you know... all my life I've been told to stand up straight, turn out posture, and now...","You know, my whole life, I've been told to stand up straight."
証拠は もう嫌というほど,"Boss, we've already been through all this. I mean, I got no leads;",I hate the evidence.
もし、生きていないなら、 イザベル・ロシェフは遠慮せずに 嫌というほど見せつけてるさ 信じろ、彼は生きている,"If he wasn't, Isabel Rochev wouldn't be so shy about rubbing it in our faces.","If he's not alive, Isabel capable of making him uncomfortable, believe me."
かなり訓練を受けた 嫌というほど,I trained you well.,I've been quite trained. I hate it.
嬉しい悲鳴よ,- Good! So good!,That's a nice scream.
完璧に身柄を奪取 騒ぎも無く 無傷で,"Clean lift. Nothing broken, nothing split.","He's been taken perfectly, clean and intact."
すべて完璧です,The pede looks perfect.,Everything is perfect.
体育館に通ったり、整形手術を せずに、完璧な容姿が手に入る...,To have perfect looks without trips to the gym or plastic surgery,"You don't have to go to a gym, do plastic surgery, get the perfect look..."
早い話が 1943年9月3日... でも完璧じゃなかった,"The point is, September the 3rd, 1943... wasn't perfect.","It was an early one, September 3rd, sure, but it wasn't perfect."
気が合ったんだ 彼女は美しく完璧だった,"We click. She's perfect. She's beautiful, she's smart, she's well-read... she's got an ass like a 20-year-old stripper.",She was beautiful and perfect.
宙に浮く?,- Can you levitate?,"What do you mean, floating?"
逆フラッシュが何かすれば 液体が宙に浮くんだ,"Whenever something happens with the Reverse-Flash, liquid floats in the air.","If the reverse-flash does something, the liquid will float upwards."
宙に浮いてるよ,She's not touching the floor.,It's floating in the sky.
目撃者証言とも合わん モノが宙に舞い...,That wouldn't explain some of the stranger events described by witnesses. Objects suspended in midair...,It doesn't match the witness testimony.
俺らは宇宙を飛んでる,"I can feel it, we're falling through Space, you and me.",We're flying out into space.
宇宙を飛ぶのは 非常に危険だ,Makes flying through space very dangerous.,It's very dangerous to fly out into space.
宇宙を飛んでるわ 完璧な弧を描いて,She flew through space in perfect arcs.,It's flying out into space. It's drawing a perfect compass.
その努力が実を結び 悪の拠点がまた一つ消滅,"It was a textbook operation, Mr. Chairman.",Their efforts have brought about the disappearance of another evil site.
苦労が実を結んだと感じる,"and I say, ""that's good, I have learned.""",It feels like hard work has come to fruition.
私には 寝耳に水の話だ,"I must admit, it's the first I'm hearing of it.",I'm talking about water in my sleep.
丸2日寝食を忘れ 生存者を避難させた,It took two whole days to evacuate everyone. Didn't sleep. We didn't eat.,I forgot to sleep for two whole days and evacuated the survivors.
察しが付くと思うけど 彼は長いこと病気でね,"Well, as you probably know, he's had this for a long time.",He's been sick for a long time.
リサと寸分違わぬ外観に,Make sure she looks exactly like Lisa.,You look so much better than Lisa.
寸暇を惜しんでね,She doesn't stop.,Take your time.
"""射程距離に入った""",I need help! He appears to be held at gunpoint but...,He's in range.
後5分で 山が射程距離に入ります,Saddle Ridge will be in weapons range in five minutes.,The mountains will reach firing range in five minutes.
くしゃみ程度でも ハンカチを持たせるのよ ? 小事は大事? わかりません?,"If they so much as sneeze, they better have a handkerchief.","Even when you're gonna sneeze, you're gonna have to hold a handkerchief, and the small things are important, don't you?"
小耳に挟んだだけ,"Oh,I shouldn't have been listening.",I was just whispering.
小耳に挟みましたよ あなたの大切な秘密も,I've heard the chatter about this private initiative.,I overheard you talking about your precious secret.
小耳に挟んだのさ,- I hear stories.,I overheard you.
あなたの尻を叩くため?,Give you a swift kick in the butt if you need it?,To hit your ass?
"""私の尻を押してくれ""と言ったんだ","He said, 'Pull back, my ass. We just got here. ""","I said, ""Try to push my butt."""
"""私の尻を押してくれ""って どういう意味ですか?","What does that mean, ""Pull back, my ass""?","What do you mean, "" push my ass""?"
奴は気付いてなかった 尻尾を出すのを待ってるんだ,"Clearly, he has no idea.",He didn't see it. He's waiting for a lead.
終に尻尾を出したな,So you're finally revealing your foxtail.,That's the end of it.
感謝するのね CDCが尻拭いをする,Thank God the CDC arrived to do your job for you.,You should thank the CDC to clean up your mess.
あるいは、シモンズの尻拭いを しなきゃ いけないのか・・・ またな?,Or am I gonna have to save Simmons' ass... again?,Or should I clean up Simmons again?
バブル時代に やりたい放題やった 上の連中の尻拭いをするために 俺達は 銀行員になったわけじゃない こんなところで追い出されてみろ,We didn't become bankers to clean up after the mess of the folks at the top who did whatever they pleased during the bubble era. all our efforts will remain unrewarded.,"You know, back in the bubbles, we got to do whatever we wanted to do, but we didn't become bankers to wipe the shit out of these guys."
長く尾を引く彗星も 勇気を取り戻した ピエールの心には 新しい未来の象徵に 思われた,It seemed to him that this dazzling comet was the perfect symbol of what he felt in his compassionate soul which brimmed with the blossom of a new life.,Even the long-tailed comet has gotten the courage to return to the hearts of Pierre a new future.
あの宝の山が見えるか?,Do you see the hoard heaped up?,Do you see that hoard?
岐路に立ったというか 現実に直面し 目が覚めた,I'm at something of a crossroads and it's brought me to a realization.,"I'm standing on a turn, facing reality, woke up."
私が強力に推進した結果 パイプライン問題は峠を越して この州の経済に 恩恵をもたらす様に成ります,"Well as I've always maintained, the corner turn oil line would be a boon to this state's economy.",The pipeline problem will be a gift to the state's economy over and over again.
嵐の前の静けさは最高だな,I like these calm little moments before the storm.,Nice quiet before the storm.
嵐の前の静けさを楽しんでる,"Oh, just, uh, enjoying the calm before the storm.",Enjoying the calm before the storm.
嵐の前の静けさじゃ,It's the deep breath before the plunge.,The calm before the storm.
"""鍵は左前輪の上にある","""The key is on the left front wheel.","""The key is on the front column on the left."
彼を左遷したら 今より状況が悪くなる,"The danger is, uh, replacing him with someone worse than the original.","If we take him left, it'll be worse than it is now."
左遷もええとこですね 大左遷ですわ これ,"This is a demotion, huge demotion",It's a little bit of a left-handed thing.
彼女も巻き添えを食います,She's collateral damage.,She's going to get involved in this.
巻き添えを食うのは ごめんだ,- But I'm not gonna let your bullshit take me down.,I don't want to get involved in this.
君たち2人も その巻き添えを食って殺される,He also made it very clear that you two would be caught in the crossfire.,You two are going to be eaten and killed.
席を外して下さい,Leave me.,"Excuse me, please."
席を外して 悪いけど,"Reg, step out. It's okay.",I'm sorry to bother you.
ロブ、席を外してくれる?,"Rob, could we have the room?","Robb, could you give us a minute?"
フロイド・マネー・ メイウェザー 銅メダリスト フロイド・マネー・ メイウェザー 銅メダリスト かつてアメリカは オリンピックを席巻,"The Olympics used to be where USA beat the crap out of the world, where we proved we were the best boxers.",America once ruled the Olympics.
そして罪のない人々が 帰らぬ人となるかも,And neither do a lot of innocent people back home.,And maybe innocent people don't come home.
見直すのを忘れてた 帳尻を合わせないと,"Obviously, we forgot or didn't go back and adjust the revenue entries.",I forgot to look over it.
幕が上がったな,The curtain rises.,Looks like we're back to square one.
幕が上がったら すぐ女神を殺す,"Soon as that curtain rises, we are gonna be there to take out this Calliope.",I'll kill the goddess as soon as I see it.
幕が上がってしまうぞ,The curtain is about to go up.,You're gonna make a scene.
今や 幕が開いたのだ 過去は序章にすぎぬのだ,"Now that we're in this time, what's past is prologue.",Now it's open. The past is just the beginning.
その時、どうでも良い 別の芝居の幕が開いた,"At that moment, the curtain rose on a parenthetical, domestic drama...","Then, it didn't matter. There was another act."
連続殺人犯 ジョー・キャロルの人生は 今朝早く幕を下ろしました,Serial killer Joe Carroll's life came to an end early this morning.,A serial killer Joe Carroll's life began early this morning.
残念だけど 幕を下ろさなきゃならなくなった ・・・・早々とね,"Sorry we had to close early, but you get the general idea.",I'm afraid I had to put it down... quickly.
もう幕を下ろすときだ,This is what takes us down.,It's time to put it down.
彼らの自由は 剥ぎ取られてる... 1度に1台のカメラ 1台の電話 1度に1メガバイト 今こそ 幕を引くべき時だ,"That their freedoms have been stripped away... one camera, one cell phone, one megabyte at a time.","Their freedom has been stripped away... one camera at a time, one phone, and now is the time to pull the trigger."
俺達のやり方で 派手に幕を閉じるんだ,We have to end it on our own terms... with a grand gesture.,It's the way we do it. It's the way we do it. It's the way we do it.
青年が行くはずだ,The boy will meet you there.,There's gotta be a young man.
年には勝てない,It is a perishable skill.,You can't beat an old man.
年を追うごとに偽造は 精巧になっている,"Every year, forgers get more and more sophisticated.","Every year, it's getting more sophisticated."
年を食ったら。 私のモットも理解できる。,"Deb, later in life, you'll appreciate my motto.","When you get older, you'll understand my feelings."
幸か不幸か、 うまくいくに違いないと信じています-,"Gentlemen, unfortunately, we must be going as well.",I believe it must be good or bad.
そりゃ、幸先がいいな,"Well, so much for our head start.","Well, that's a good start."
幸先がいい,The gods favor you.,It's a good start.
幸先がいいな,A good start.,It's a good start.
この船のほうが 船底が浅いのよね?,"- We're shallower on the draft, right?","This ship is shallower, isn't it?"
あと1〜2ヵ月で 資本金は底を突く,"What can we do? We've only got capital to last a month, maybe two.","In a month or two, the capital will be at the bottom."
店を畳んでたら こうはなってないわ,"If you'd just quit the restaurant, none of this would've happened.",This wouldn't have happened if I hadn't been at the store.
だが それでお前が 店を畳んだだろ,"You made the right choice, though, didn't you, by choosing to close the restaurant?",But that's why you built the shop.
店を畳んでないのが 見えませんか?,"What, you want me to close the shop?",Don't you see that I'm not at the store?
- 店を閉める時は死ぬ時 - 良い知らせがあります,- I'll close the shop only when I croak.,"- When you close the shop, you die."
それから店を閉めて 退勤しろ,Then close up the shop. Clock out.,Then close the shop and get out of here.
危険を承知で弓を引いた,"Sorry, Harv, I know you have a thing for her.",I pulled a bow knowing it was in danger.
I wasn't referring to the wheelchair 私 車椅子を 引き合いに 出すつもりは なかった,I wasn't referring to the wheelchair.,I wasn't referring to the wheelゴールe.
あなたはうんざりしてる 彼はローレルを引き合いに出した,"Ok, you're pissed he invoked the almighty Laurel.",You're sick. He brought Laurel in.
それに対して 君の本では 虐待をアニスが自分に打ち明けたと言う 隣人を匿名で 引き合いに出した,"Your book, on the other hand, you quoted an anonymous source, a neighbor who claimed that Ennis had confided in him about the abuses.","On the other hand, your book says that Ennis told you about the abuse, and you've asked your neighbors anonymously."
オリバー・クィーン並みの 大金持ちよ 彼が大金持ちだから 引き合いに出しただけ 気にしないで,"I would be as rich as Oliver Queen, who I mention because he's the richest person I know, or used to be.","He's a millionaire like Oliver Queen, and he's a millionaire because he's a millionaire, so don't worry about it."
トレーラーが引き金になって 全て思い出す可能性があるが,"If going to the trailer helps bring back her memories, then there's a chance that she's gonna remember everything.",You might remember everything from the trailer.
3年前の手術で頭部を傷つけて 早期発症の引き金になっていたかも,The head trauma that put him in surgery three years ago could've triggered an early onset.,He could have triggered an early seizure.
引き金になる,It all triggers it.,It's a trigger.
最悪な時こそ誰にも引けを取らない,Called the best by one of the worst on the planet.,"In the worst of times, we don't bow to anyone."
そこで中野渡さんに引導を渡して,and he'll sit in the chairman's seat. Is that it?,That's when I gave Ms. Nano.
ロルカが引導を渡されるのを見たい,Hector lorca being sent away for life.,I'd like to see lorca give me a sword.
〈大学病院の医局は弱体化し→ 命のやりとりをする医療も→ ついに 弱肉強食の時代に突入した〉,"University hospitals' medical offices were losing power, and even medicine, which deals with life and death, plunged into an era where the law of jungle prevailed.","University hospitals' medical offices were losing power, and even medicine, which deals with life and death, plunged into an era where the law of jungle prevails."
弱音を吐いている,- Whi... Whinier than I thought. - Hmm.,He's making a wee noise.
君がした中で 当を得た陳述は これが初めてだ,That's the first correct statement you've made.,This is the first public statement you've made.
いや 当を得てるでしょ,"No, that was a bull's eye.","No, you've got a lot of money."
いい感じだろ? 口当たりがいいな,"It's pretty good, huh?","It's nice, isn't it?"
"""当たって砕けろ"" よ","Well, it can't hurt to ask.",You're gonna have to hit it and shatter it.
臆病で影が薄かった,"He was quiet, timid, almost invisible.",He was a coward. He had a thin shadow.
ホタルの影も形もない,No sign of Firefly.,"No shadow, no shape."
影も形もなく隠せるわよ,And you will never find this again until I want you to find it.,You can hide it without shadow or shape.
大統領は影も形もない,No sign of the President yet.,"The president has no shadow, no form."
それがお前に 影を落としてる,"Cast a long shadow, I bet.",That's what's giving you the shadows.
そうだなぁ 魔獣の呪文が 何にでも 影を落としているからなぁ,"Yeah, well, the spell of a hexenbiest does tend to put a damper on the good times.","Yeah, well, the Hexenbiest's spell has cast a shadow on everything."
ねぇ ハロルド 男の人ってどうしてこんなに 往生際が悪いのかしら?,"Really, Harold, why do men always seek to delay the inevitable?","You know, Harold, how can a man be so bad at a time like this?"
往生際が悪いわね,Too bad.,That's not a good place to be.
どのみち 今の俺には もう後がない あッ...,it's sink or swim for me.,"Either way, I don't have much time."
彼に逆らったのは 後にも先にもキミだけだよ,You're the only one who's ever stood up to him.,You're the only one who's ever defied him.
いくら謝っても足りないわ 後の祭りだけど...,"You know I'm going to be apologizing forever, right? Just so you know.","Look, I'm not gonna apologize for what happened at the after party, but..."
"""開けたら空だった""じゃ 後の祭りよ","We crack it, it's empty, the gold's somewhere else.","""It's empty when you open it,"" that's the after party."
ネットに載せたら もう後の祭りだ,"As Miss Adler remarks in her masthead, know when you are beaten.",I'm gonna put it on the Internet and it's gonna be the next party.
あれは後を引いたよ 止められなくなる,That's become a real whore to me. I can't shake it.,It pulled me back. I can't stop it.
後れを取るわけには いきません,I would be ashamed to be left behind.,I can't take the fall for this.
トミーが去ってから 俺達は後れを取ってる,We're way behind since Tommy left.,"Since Tommy left, we've been taking a turn."
後ろを見せるな ハリー・ポッター!,"Don't you turn your back on me, Harry Potter!","Don't look back, Harry Potter!"
後味が悪い,I don't feel good with it.,It's disgusting.
ハートは回収の後押しをした,Hart was the force behind the recall.,The heart was pushing to retrieve it.
にわか仕込みの信心で わしの後釜に座る気か?,Does he seek to humble me with his new found piety?,Are you going to sit on my tail because of your faith?
俺はお前の後釜に座って さらにハッピーさ,And I'll be more than happy to fill your shoes.,I'm even happy to sit on your tail.
私を今の地位から追い出して 自分が後釜に座ろうと 画策しているのよ,"You're trying to drive me from my position, so you can take over.",They're trying to get me out of my position and take my place as their heir.
服従心の事?,About their obedience?,Submission?
得体が知れないわ,We don't even know what that is.,I don't know what it is.
"だが, 得心が行かぬ.",But something bothers me...,But I can't help it.
彼らは すべてを殺す・・・ 慈悲や後悔は微塵も無い,They'll kill everything... without mercy or remorse.,They kill everything... with no mercy or remorse.
心が乱れてるんだ,He's got a lot on his mind.,You're in a lot of trouble.
ワシの申し出に心が動いておる,That's why I put a special wimp clause in my will.,He's moved by my offer.
チャーリーは あの馬鹿なカードを受け取ってから 心が洗われたようだった 彼女は セラピーに来て,"Charlie had this, this... moment of clarity... after she got that stupid card.",Looks like Charlie's mind was being cleaned up since he got that stupid card.
最高のオモチャを見つけて 久しぶりに心が躍りました,I had found the perfect plaything. My heart danced with joy for the first time in a long time.,It's been a long time since I've found my best toy.
♪ 心が躍るの,There 'll be magic There 'll be fun,My heart's beating
ゾーンと心が 通いあう人間ですから,"You see, being a stalker is some sort of calling.",Because you're the one who's in the Zone's heart.
心が通い合えば 治療に役立つ。,"If you can connect with each other, it's easier to treat them.",It's good to be able to help with the cure.
何週間、何ヶ月離れていても 地球の裏側にいても 心が通っていました,"The weeks away lengthened to months, but every day would bring his thoughts from some distant part.","Even weeks, months away, on the other side of the Earth, my heart was filling in."
訓練生仲間とは 心が通じあってると思っていた,These people were my friends... or at least I thought they were.,I thought you and your trainees had a lot in common.
そして目を合わせるだけで 心が通じ合う気がします,And I feel I can communicate with you with simply a look.,And it feels like it's just eye-to- eye.
俺が言いたいのは 心に刻んでくれ 仕事には ケガが付きまとう,So the upside of this... it is a stark reminder injuries do not get swept under the rug on this job.,What I'm trying to tell you is that it's important to remember that you never get hurt in your job.
ルーディがロボットを 解体しているのを見てたら- ふと こう思ったんです 誰が僕のことを心に 刻んでくれるんだろう ってね,"Just looking at that bot on Rudy's table makes me think, who is going to remember me?","When I saw Rudy dismembering the robot, I thought, ""Who's gonna carve me in my heart?"""
メイザー・ラッカムの勇気を 君らの心に刻んで欲しい,Let the courage of Mazer Rackham be your inspiration.,Mayer Rackham's courage be in your hearts.
パキスタンの音楽は 一生心に残るらしいね,"I've heard enough Pakistani music to last a lifetime, if you don't mind.",I hear the music in Pakistan will be remembered forever.
ジョンの面白い話を知っているか? (本: 心に残る結婚式のスピーチ),Do you know any funny stories about John?,Do you know a funny story about John?
どうしよう 心に残りすぎ,She's on my mind.,I don't know what to do.
初めに心に浮かんだ言葉です,It's the word that came to mind.,That's what first came to my mind.
