sent,reference,translation
- 調べがついたところじゃ 家族を失って 彼はひどく荒み,"- Well,based on we could find, he was so devastated losing his family,","- As far as we know, he's lost his family, and he's been through a lot."
奴が自分じゃ買えない物を全部買うために 君から金を借りたことは 2分で調べがついた,"Well, it took us all of two minutes to find out he borrowed money from you, to buy all that stuff he really couldn't afford.",He borrowed money from you to buy everything he couldn't buy in two minutes.
調子がいいサインだよ ジェームスにとってはね,"Good sign, actually. Means he's stoked.",It's a good sign for James.
今夜は調子がいいな オレはちょっとトイレまで,"You're having a good night. Mm-hmm. Okay, I am now gonna take the long walk to the little boy's room.",I'm feeling better tonight. I'm gonna go to the bathroom.
僕は 君と一緒にいた方が 調子がいい,"I am... better with you, Watson.",I'd rather be with you.
席は1つだけだ 調子に乗るなよ マリア,"You get one of those as captain, but don't push your luck, Maria.","There's only one seat. Don't get carried away, Maria."
証拠はない 調子に乗るな,"No proof, but you're not innocent yet! So let me defend you and stay quiet...",There's no proof. Don't get upset.
"2,3分は調子を合わせるんです でも... すぐに仕事に戻りました","And he'd play along for a few minutes, but... then he'd leave for work.","I'm gonna get in a few minutes, but... I got back to work right away."
それで なんで調子を合わせる フィンチ?,"So why'd you even play along, Finch?","So why are we in this together, Finch?"
君と私は長い間友情をもってやってきた、 触れることなく、だが音のように、 いつも君に心の調子を合わせていると感じていた。,"You and I went so long in our friendship without ever touching, yet I always felt attuned to you.","You and I have been in friendship for a long time, not to touch it, but as the sound, we've always sensed you're in harmony."
とにかく... 論より証拠だ,"Anyway, the proof is in the pudding.",Anyway... evidence rather than logic.
諸刃の剣だよ,Perception's a tool that's pointed on both ends.,It's a sword.
張り込みでの水分補給は どっちみち諸刃の剣だ,Hydrating on a stakeout is a double-edged sword anyway.,The water supply in the stakeout is a sword of many blades anyway.
我々は諸手を挙げて賛成する,None of us had any problems with that.,We will raise our hands and vote for it.
豹変したのだと もっぱらの噂だ,People say he's changed.,It's been rumored that he's changed his mind.
彼の目が 瞳が豹変して,His eyes were different.,"His eyes changed, his eyes changed."
今、多くの軍は有るが その兵の 財布を握る者がいるので,Now we've got as many armies as there are men with gold in their purse.,"There are many army now, but there are people who hold the wallet of those men."
- 上層部はあなたに責めを負わせたの?,They're letting you take the fall?,- Did your superiors blame you?
爆破を仕掛けるのは 君だが 責めを負うのは ELMだ,"You get the blast, they get the blame.","You're the one who set off the bomb, but you're the one who's responsible."
身代わりに 責めを負うこと,A scapegoat.,Take responsibility for what you've done.
君は責めを負う覚悟でいる 理由は 飛んで火に入る夏の虫の アダリンド親子を 逃がしたからで,"You feel awful and take full responsibility for failing to stop Adalind and her child from slipping from your grasp and getting away, despite the fact that we had intercepted communications from Resistance agents, which gave you sufficient time to disrupt their plans.",You're willing to take the blame for letting Adalind and the summer bugs fly into the fire.
汚れ役を買って出なきゃ いけなかったりもすると思うの,I think it means you might have to take on the dirty job at times.,I guess I'm gonna have to buy a dirty part out.
会社が買って出た?,Harbinger sponsored that?,The company bought it?
金のためなら 患者を どんな危険な目に遭わせようと→ オペを買って出る。,"She volunteers to take on any operation for money, no matter how great the risk to the patient.","For the money, I would buy the surgery, no matter how dangerous it would be for my patients."
顔が赤くなるわ・・・,You got me blushing' 'til I...,It's gonna make your face red.
赤子の手をねじるようなもの,It's child play.,It's like a baby twisting hands.
赤子の手を捻るが如く 神がルシファーを倒したように 皆あなたに復讐するのよ,They will seek a vengeance on you that will make God striking down Lucifer seem like child's play.,"They'll pay for you, just as God defeated Lucifer."
今までにない 趣向を凝らしている,It is a spectacle unlike most have ever witnessed.,It's a diversion that we've never seen before.
僕は趣向を凝らしてるんだ。,I'm trying different things.,I'm sorting things out.
相対性理論と量子論の 融合には不足があった,The equation couldn't reconcile relativity with quantum mechanics. You need more. More?,There was a shortage in the combination of relative theory and quantum theory.
リードのお嬢様は堅苦しくて冗談が通じない 地に足が付いてるのかしら,"Lady Reed here's got a stick so far up her ass, it's a wonder her feet touch the ground.","Reed's young lady is a shy little bitch who can't get a joke through, she's got legs on the ground."
あなたは足が付いている,They might be able to trace the reset signal back to you.,You've got legs.
だが 君から俺達に足が付くんじゃ?,Hang on. Wouldn't it be awful if it was traceable back to us?,But it's not like you're going to follow us.
? ) 足が出て当然だ,No wonder he has issues.,It's a good thing we're not going anywhere.
足が出ない,But my feet wouldn't move.,I can't feel my legs.
- 足が早いのは誰だ?,Whoever's the fastest runner. - Who is that? - I am.,- Who's faster?
ケスラーみたいな輩は 逃げ足が早いんだ,"The quieter we are, the better chance we have in getting him.","Guys like員ler, they run faster than you think."
雷に撃たれて 足が早くなった青年よ,Struck by lighting? Was in a coma for nine months? Woke up being able to run faster than the speed of sound?,He's a young man who got struck by lightning.
足が速い以外に、何か 特技があるといいけど。,I hope you're bringing more to the table than just quick reflexes.,"Aside from being fast, I'm sure you're good at something."
逃げ足が速い! ! ?,They're getting away!,He's moving fast!
我々にはある言い伝えがあった 足が速く... 雪のように白い...,"There's a prophecy that tells of a creature, swift of foot white as snow.",There was a legend about us... that our legs are fast... as white as a snow...
海岸は 完全に開放され 世界でも有数の美しい景色が楽しめます この痛ましい事件ひとつのために 人々の足が遠のかないことを願っています,"The beaches are fully opened, it's a beautiful part of the world and... we hope people aren't put off coming by this... tragic, yet isolated event.",I hope the beaches are completely set free and the most beautiful view in the world for one of these tragic events.
あぁ... 足が重いわ...,"Fuck, my feet are killing me.",My legs are heavy.
それぞれに足を入れろ エリック,"One for each leg, Eric.","Put your legs in each one, Erik."
彼が足を入れた場所に 薬の痕跡が残ってたから,There are still tiny traces of it in the trainers from where he put the cream on his feet.,There were traces of drugs at the place where he put his legs.
封筒には ウサギの足を入れた,So I put my rabbit's foot in that package.,I put rabbit's legs in the envelope.
奴が絨毯に足を取られて,His foot got caught in the shag throw.,He's got a leg in the carpet.
僕の足を引っ張りに 席のあるうちに行かなきゃ!,"Daniel brought in Chad to backstab me-- oh, I mean help me-- and I gotta get to work before he helps me out of a job.",I have to go get a seat to pull my legs!
足を引っ張るな,To me you're dead weight.,Don't drag my legs.
ゲームがこの子の 足を引っ張ってるね,"Because of this gaming, it pulled him right down.",The game is pulling her legs.
私は書斎から出てきたことはないし 彼女も階段で足を止めたことなどない,I never left my study. Never stopped her on the stairs.,"I never came out of my office, and she never stopped me on the stairs."
バギンズ殿 足を止めるんじゃない,Master Baggins... I suggest you keep up.,"Lord Baggins, don't stop."
足を止めろ,You got to stop tapping.,Stop.
足を洗うんだ 友達は殺された,Don't do the job.,Wash your feet. Your friend's been killed.
俺は汚いビジネスから 足を洗うよ,I'm gonna wash my hands of our dirty little business.,I'm gonna get out of this dirty business.
1週間前は 足を洗うと言ってただろ,A week ago you talked like you were all ready to hang it up.,You said you were going to wash your leg a week ago.
多くの吸血鬼が自分の領土に足を踏み入れたように 多くのクイートも戻ってきた,"As more vampires set foot in their territory, more Quileutes turned.","As many vampires have set foot in their lands, many Queens have returned."
このアントンは うんざりする男だ 地獄の王国に足を踏み入れた,"This Anton... he may have been a skeevy bloke, but he had a toe in the nether realm, all right.",I'm so sick of this guy. He's gone into the kingdom of hell.
可愛い天才君が 足を踏み入れたんだろ 役員会の連中は 歓迎したか?,"Did you walk in there, do your adorable boy genius thing, and the board of directors was less than impressed?",Did the board welcome you?
「ヴィン、こんなはした金のために、 オレにここまで足を運ばせないでくれ」,"Vin, don't make me have to come down here again for this.","Vin, don't let me come here for this money."
ブログでフラッシュの 活躍を読んでー 今まで事件現場に足を運んだ,"I read your friend Iris' blog post on The Flash, and I visited all the crime scenes you fought at.","I've read about The Flash's performances on the blog, and I've been following him to the crime scene."
彼にこれ以上足元を見ることを許さず 自分の好意を証明した,You demonstrated your goodwill without allowing him to take further advantage.,I made sure he didn't have to look at any more footprints.
足元を見て歩いて,"Woman: How 'bout, this time, you watch where you're going?",Look at your feet and walk.
足元を見な,Thanks for dropping by.,Look at his feet.
ロビーが足場を固め バッターボックスに入ります,- That's the name. Robby digs in and we're under way.,Robbie's locking down the field and going into the batter's box.
この国はその足場を 失う危険があった,This country has always been in danger of losing its footing.,This country was in danger of losing its foothold.
気を付けて 馬が足場を失う,Careful. Your horse could have lost its footing.,"Careful, the horses will lose ground."
私の隊を送ったが ドイツ軍に足止めを食らっている,Jerry took them out.,"I sent my troops, but the Germans are holding me."
うちらがアウター・リムで足止めを食らった,We have been stranded out here without any help at all.,We're trapped at the Outer任務.
船が故障して 直るまで 足止めを食らってるのよ,"Our ship was damaged, and we're stranded here until we can repair it.",We're stuck here till the ship's broken and fixed.
謙譲と美徳を足蹴にしているのだ,Violating and humiliating Charity and Virtue.,I'm using humility and dignity as a footing.
6ドルじゃ路頭に迷う,Six dollars an hour puts my family on the street.,Six bucks and you're lost in the alley.
俺がいなきゃ姉一家は路頭に迷ってた ―そうなの?,"If I wasn't there, they'd be on the street.","If it wasn't for me, my sister's family would be lost at the alley."
我々 メガバンクは 絶対に つぶれてはいけないんだ それだけは死守せねばならない もし つぶれでもしたら 何百万人 何千万人が 路頭に迷うか 分かってますか?,Our mega-bank cannot collapse. do you know how many millions of people will be out in the cold? some sacrifice is inevitable.,"We can't destroy the Mega Bank, which means we can't destroy it, because if we do, millions, millions of people will be lost on the road."
誰かがすでに盗んでた たぶん 誰かが 捕まえるのに躍起になってる,"Someone had already jacked it, perhaps someone who's out to get him.","Someone was already stealing it, maybe someone's getting desperate to catch it."
小さな町で行方不明の女の子 皆が躍起になって探す,Missing girl in a small town would throw up all kinds of red flags.,"A missing girl in a small town, everyone's desperate to find her."
あんたの部下が この電話を辿ろうと 躍起になってるなら 落ち着くように言ってくれ,"If your men are scrambling to trace this call, you can tell them to relax.","If one of your men is desperate to follow this call, tell him to calm down."
俺は不死身になり 強大な力を得た,Now I'm immortal and supercharged!,I'm immortal. I've gained a great deal of power.
身に余るご紹介を どうも,"My thanks, Mr. McCabe, you are too kind.",Thank you for giving me an extra hand.
身に余る光栄です 違う。,We don't deserve this honor.,- It's too much of an honor.
身も蓋もないが 仕方が無い,"There's no great way to say this, so I'll just say it.","I don't have a cover, but I have no choice."
"""穏やかな夜に 身を任せるな""",Do not go gentle into that good night,Do not go gentle into that good night
気高い貴方に恥知らずに身を任せた,Flee from the corpse of one who unworthily gave herself to a man of honour,I surrendered myself without shame to the noble one
見知らぬ者は二月初めに来た... ある冬の日... 身を切るような風と 雪が降る中,"""The stranger came early in February... one wintry day... through a biting wind and a driving snow.",The stranger came in early February... one winter day... with wind and snow falling.
(吉森) 岩崎先生が身を削って 作りあげたものは お前たちそのものだ !,The thing that Iwazaki created at his own expense... Is YOU people!,What Iwazaki-sensei had done and made was you!
〈身を削ってる〉,[Seth] ...for better or worse.,He's shaving himself.
ついにジェイソンも 身を固めるか?,So is this it? She the one gonna take jason stackhouse Off the market for good?,"Will Jason finally settle down, too?"
長男がついに身を固めた,My elder son is finally taken!,My eldest son has finally settled down.
どこに身を寄せた,Where'd you go? Who took you in?,Where did you come from?
各地から逃れたドゥネダインが- タウアディルに身を寄せた,Taurdal filled as many of the Dúnedain fled their homes and sought safety in numbers.,"Dunedain, who fled our homeland, turned against the people oflowadil."
私に身を寄せなければ 安全じゃない,And now I know my son is not safe unless he's by my side.,"If you don't come to me, you're not safe."
人というのは 自分が許してしまえば ここまで深く 身を沈めてしまうのだと 思い出させるために,It reminds me of the depths to which a man can sink if he lets himself.,I'm trying to remind you that people sink this deep in order to be able to forgive themselves.
これは議論じゃあない まるでグリルで身を焼かれるようだ,"No, this isn't a discussion, it's a grilling.",This isn't an argument. It's like you're being burned by a thrill.
お前自身を焼き尽くすのだ,It's gonna burn you out.,Burn yourself.
大変だな・・ 男社会で身を立てて行くのは,Amazing... what one has to do to get ahead in a man's world.,It's hard... to stand up for yourself in a man's world.
しかし あんたが消えた後も 俺は舞台にいて 演劇で身を立てて 情熱を燃やし 複雑な感情と闘う それが演劇ってもんだ,"But long after you're gone, I'll be on that stage... earning my living, baring my soul, wrestling with complex emotions, 'cause that's what we do.","But even after you vanished, I'm still on the stage, setting myself up in a play, burning my passions, fighting my complex emotions."
家族のために 身を粉にしてる,You're slaving away so you can give us a good life.,He's shattered himself for his family.
どこで犯罪者に 身を落としたのかな,"I mean, what do you think it is that makes them who they are?",I don't know where you dropped yourself a criminal.
もう依頼人でも無い人のために あなたが身銭を切る 義務も無いのよ,Nor are you obligated to spend your savings on behalf of someone who's no longer your client.,You don't owe me anything to cut money for someone who's not my client anymore.
どのように奇妙な 私はルシファーが軌道に乗ることができない,How strange I can't get Calcifer going,How strange I can't get Calcifer into orbit
ラグランジュポイントを越えて軌道に乗るよ、 無事に、ハーシェル(火星のクレーター)へ。,The trajectory will take it beyond the Lagrange point so that it doesn't hit Herschel.,"I'm going to take a ride across the ramble point, safely to Hershel."
一連のすべてが軌道に乗ってるか... 評価したいだけだ,I am merely trying to assess just how close this train is hugging the tracks.,I'm just trying to determine whether everything is in orbit.
おい 軽口を叩くな,"Hey, Earl, have some fucking respect, okay?","Hey, don't be shy."
アーノルドと同じ轍を踏むな,You mustn't make Arnold's mistake.,Don't steer the same path as Arnold.
導かれる答えは一つ... だが 昨夜と同じ轍を踏まないように より多くの情報を収集した― ゆえに 遅れたわけだ,"The clues point in one direction, but to avoid repeating last night's debacle I was obliged to collect more sufficient data, hence my tardiness.","There's only one answer that leads to it, but you've collected more information to avoid the same mistake you did last night, which is why you're late."
まるで -- 辻<unk>が合わない,It looks like-- It doesn't add up.,It's like-- it doesn't fit.
辻<unk>が合わないわ,And it makes no sense.,It doesn't make any sense.
"""そうか"" じゃ無い 辻<unk>が合わない","No, no, not okay, it doesn't make sense.",I don't think so. It doesn't make any sense.
もしそうなら、どのように辻<unk>を合わせますか あなたの医師兼トレーナーが ドーピングに関わっていることについては?,"And if so, how do you reconcile that with your doctor/trainer being so associated with doping?","If that's the case, what would you suggest that your doctor's coach is involved in the dopeing?"
返す言葉がないね,"Well, what can I say to that?",I don't know what to say.
そう言われたら 返す言葉がないわ そういうことさ,- Then there's nothing I can say.,That's what I'm going to say. That's what I'm gonna say.
迷える羊の捜索は あんたに任せるよ,I'll leave you to track down your lost sheep.,I'll leave you to look for the lost sheep.
迷宮入り事件を調べるように言え,Tell him to go over cold cases.,Tell him to look into the cold case.
無線を切って その迷宮入りの件の調査を 俺のとこに送ってくれ,"Sign off on the cold cases, and have them sent to me. Right.","Turn off the radio, and send me the investigation into that labyrinth."
全部迷宮入り事件だ,Cold cases.,It's all a cold case.
つまり 悲しみに打ちひしがれる家族に 追い討ちを掛ける訳だ,So he returns to feed off the grief he's caused by blinding his victims.,That's why you're throwing away a family full of sorrows.
逃がした魚は大きいですよ,You don't know what you're missing.,The fish you let go is big.
あっ そうか 悪かった 逃がした魚は大きいぞ,"Oh. Yeah, okay, yeah. Too bad.","Oh, I'm sorry. The fish you let go is big."
逃がした魚は大きいわ,The one that got away.,The fish you let go is big.
きっと 逃げるが勝ちと 考えたんだろう,Guess he figured discretion's the better part of valor.,"I'm guessing he thought he could run, but win."
私は逃げも隠れもしない,I don't believe in the hidden ball trick.,I don't run or hide.
俺は逃げも隠れもしない,"I won't run and hide, you understand?","I don't run, I don't hide."
逃げも隠れもしない,I'm right here.,"No running, no hiding."
私が笑いかけても 逃げ腰になるの,He starts backing away if I even smile at him.,"If I smile, you'll be on the run."
逃げ腰にならなくてもいいよ ワイリーがセキュリティー面は,Don't be defeatist.,You don't have to run off like that.
いざ愛を告白されると 逃げ腰になる,"I mean, why is it that we all need to be loved but then when somebody finally says, ""I love you,"" people just run scared.","Sometimes when someone tells you you're in love, you're running."
ゴルゴ13じゃねえんだから 逆立ちしても お前には無理だ,"Riggs, there ain't but three shooters in the whole damn world who can make that shot, and you ain't one of 'em!",You're not 13 years old. You can't stand on your head.
途方に暮れてる,clueless on the floor.,I'm lost.
俺は 見たくない お前が イラつき 途方に暮れる姿を...,I don't wanna see you wake up one day all old and pissed off realising you're lost.,I don't want to see you get upset and depressed.
息子のことで途方に 暮れてるシングル・マザーだった 彼は何度も逃げて 学校から追放され内向的になっていた,"A single mother at her wits' end about her son, a thieving introvert expelled from school because he kept running away,","She was a single mother who was upset about her son, and he ran away from school several times, and she was being thrown out."
明るい見通しを持てないというのなら 心臓を調べてもらったほうがいいでしょう。 なぜなら、途方もない見事な素晴らしい猛然と突き進む、 この世界の人々の集団が、何とかしようと 取り組んでいるのですから。,"because there is an extraordinary, beautiful, gorgeus, fierce group of people in this world, who are taking this on.","If you don't have a bright view, you might as well get a look at your heart, because a group of people in this world are trying to make it work."
やっぱり全世界一 セクシーなのは... 途方もない銃を 持つ美女だな,There is nothing more sexy in the whole world than a beautiful woman with an incredible gun.,The hottest girl in the world is the one with the most amazing gun.
- サットンは途方もない悪だった,- Sutton was a much greater evil. - Was?,- Sutton was a great evil.
これは途轍もない大きさです ここ、カリフォルニアで 東海岸でも感じられるでしょう,It will be so big that even though it's happening here in California you will feel it on the East Coast.,"It's an incredible size, you'll feel it here, in California, on the East Coast."
ミュージカルへの投資には危険が伴う だけどヒットすれば 見返りは途轍もなく大きい,"Investing in a musical can be risky, but when a show hits, there's literally no limit to the return.","There's a risk of investing in a musical, but if you get a hit, the return will be imminent."
ジョージ・ラズレ エイリアン ハンター 通りがいいのは UFO研究家です,"George Lazure, alien hunter. Or if you prefer, ufologist.","George Lazle, alien, hunter, the streets are good for M.I.S. researchers."
遅かれ早かれ彼らは 正面を向くだろう,"Oh, they'll swing around to the front sooner or later.","Sooner or later, they'll turn to the front."
遅かれ早かれ したくない事でも やることになるわ,"You know, sooner or later, you're gonna have to do something for them you don't want to.","Sooner or later, you're gonna do whatever you don't want to do."
私たちはビルに居て静かにできるわ でも 遅かれ早かれ私たちは彼らを 引っ張りだすつもりよ,"We can stay close to the buildings and keep quiet, but sooner or later, we're gonna be drawing 'em.","We can stay in the building and be quiet, but sooner or later, we're gonna pull them out."
運が向いてきたようね,- You ready for me to make your day?,Looks like you've come a long way.
俺を欲しがってる 運が向いてきたぜ!,They want me. We're going to the big time!,She wants me. She's got a lot of luck.
- 続けてれば運が向くかも,- Stay on it. We might get lucky.,"- If we keep going, we might get lucky."
運を天に任せるなんて したくないの...,I DON'T LIKE TO LEAVE MUCH TO CHANCE...,I don't want to leave my luck to the heavens.
