sent,reference,translation
気を持たせるだけだなと思って 言えなかったのね,I figured that would just lead him on.,"I just wanted to make you pay attention, but I couldn't tell you."
気を確かに持つんだ!,Stay awake! Stay awake!,You have to be careful!
気を落とすな 覚えてる,Be brave I'll remember you,"Don't take it personally, I remember."
気を落とさずに,God bless.,Keep an eye out.
気を落とさないで ヴィクター,"Take care,victor.","Don't take it personally, Viktor."
僕は本当に彼女に気を許していた,I really let her in.,I really did forgive her.
ジュリエット 気を許すな,"Juliette, you can't trust her.","Juliette, I'm sorry."
白状させるには 信用できる誰かが要る 気を許してしいる誰かだ,"Look, if we're gonna get him to confess, it has to be with someone that he truly trusts, someone that he'll genuinely let his guard down with.","I need someone I can trust to come clean, someone I can forgive."
健康には気を遣わないと,"We're watching our cholesterol, I guess. Not me.",You need to take good care of yourself.
これは特に気を遣うの 注意して,That one's very fragile. Be careful.,This one's gotta be extra careful.
あなたのお父さんは 色々と気を配るのよ,"Your dad, he is so thoughtful, to the end.",Your father cares a lot about things.
あなたと違い 気を配ってるので 好きな時間や 相棒を迎えに来る時間など,"Yes, I, unlike you, pay attention to details, like what time it is and what time you're supposed to pick up your partner for shift.","Unlike you, I pay more attention to the time of your life, or when you're coming to pick up your partner."
細かいところまで 気を配らないと,It's an attention to detail.,You have to pay attention to the details.
落ち着くんだ 気を静めろ,"Okay, McFly. Get a grip on yourself.",Calm down. Calm down.
気を静めて入りなさい,So you better pull yourself together and get in there.,Just calm down and come in.
まあ奥様 気を静めてください,"Please, don't get upset, Princess. It's just your imagination, because, I assure you...","Well, ma'am, please calm down."
全然 気合が入ってない,There's absolutely no commitment.,"No, not at all."
鳥井教授 今日は 一段と気合が入ってますよ ええ。,Professor Torii is certainly fired up today.,"Professor Torii, you have a lot on your mind today."
気合を入れろ!,Put some spunk into it!,Look out!
チアリーダーたちが劇で 気合を入れてくれるようだ,The cheerleaders have put together a skit to help get us in the spirit.,Looks like the cheerleaders are going to pay more attention in the play.
もっと気合を入れて練習を始めろ ニーマン,"Start practicing harder, Neiman.","Start practicing with a little more attention, Neiman."
君よりも、私のほうがずっと気味が悪いと 思われてるよ、マーゴ。,"I'm much weirder than you will ever be, Margot.","They think I'm a lot less creepy than you, Margot."
気味が悪くて広い場所だ,"I know it's spooky, big guy.","It's a creepy, big place."
気味が悪いな,Spooky.,That's creepy.
謝罪するなら すべてを水に流すそうよ,He says he'll drop the whole thing if you apologize.,"If you're going to apologize, he's going to drop the whole matter."
まさか水に流すよ,"Live and let live, man.",I'm not gonna let that happen.
ジュニア 赤ん坊を渡せ すべて水に流そう,"Junior, look, hand over the baby, and we'll let bygones be bygones.","Junior, give me the baby. Let's put everything behind us."
だが言い終わる前に あの光に水を差された 話の続きを期待してるんだが,"But before he could finish, we were interrupted by that flash of light and I'm hoping we can pick up where we left off.","But before I finish, I was hoping you'd finish talking about the light."
水を差すようだが 操ってはならん,"I hate to interrupt, But glamour is not permitted.","I know it's a bit of a diversion, but you can't control it."
チャドが生活体験者の名簿を 持って来なければ 全て水の泡,"If Chad doesn't get back with that list of live-aboards, it was all for nothing.","If Chad doesn't bring me a list of living-aboards, all bets are off."
私が捕まれば全てが水の泡,"If they arrest me, this mission is blown.","If they catch me, everything goes to hell."
今を逃せば水の泡,It's a needle in a haystack after this.,"If we let go now, we'll lose it."
"水火も辞せずついて行きます""","To the bitter end.""",I'm going with you.
パン工房は ほんの氷山の一角ね,The bakery's just the tip of the iceberg.,The bakery is just the tip of the iceberg.
歴史教科書から氷山の一角にしか学べない 自分の手で直接体験した方がよい,"Archive texts can only teach you a part of the picture, my young Padawan. You'll learn a lot more through some hands-on experience.","From the history textbook, you can only learn the tip of the ice. You should experience it yourself."
心をなくしてた それが彼女 スポーツして汗を流すこともなく ただひたすら研究してた,"You're losing your mind, and there she is, working just as hard, not even breaking a sweat.","She was losing her mind, and she didn't do sports, she just did research."
そうです 食事はビーガン 走って汗を流します,"Yeah, I actually did. I'm a vegan. And I started working out, and running, and working out, and running...",That's right. The food is began. He's running and sweating.
共に血と汗を流し 弾の雨をくぐって来た,"We've shared blood, sweat and precious metal together.","We've been bleeding and sweating together, through the rain of bullets."
決を採ろう,We should vote.,Let's make a decision.
この場で決を採ろう,"On behalf of custodial services,",Let's make a decision here.
決まりが悪いわ。,He'd be embarrassed.,That's not a good idea.
- ちょっと 決まりが悪いな,"- Yeah, but it'd be pretty awkward.",- It's a bit of a mess.
キャット・グラントは、Catcoの ハックについて沈黙を 破ろうとしています。,It seems Cat Grant's silence regarding the Catco hack is about to be broken.,Cat Grant is about to break the silence about Catco's hack.
その一帯に<unk>貨物船が到着次第 無線で沈黙を破ります,"Soon as the decoy freighters arrive in the system, they'll break wireless silence.","As soon as the freighter arrives in the area, the radio will break the silence."
夫が沈黙を破ります 妻の失踪に― 彼の不倫や噂の事を,"A husband breaks his silence, not just on his wife's disappearance... but on his infidelity, and all those shocking rumors.","My husband is going to remain silent about the disappearance of his wife, about his affairs and rumors."
油が切れてるな,Transmission's dry.,You're running low on oil.
よう なんだ 一体どこで油を売っていた?,"Hey, man, where'd you run off to?","Hey, man, where the hell have you been selling oil?"
冬が来るまでずっと ここで油を売ってるつもりか?,Do you plan on sitting here scratching your balls till winter?,You think you're selling oil here all the time until winter?
油を売るために 電話した訳じゃない,"I don't make the call about which, if any, of these charges hold water.",I didn't call to sell oil.
私の頭に油を注いでくださる 私の杯は 溢れています,"""You anoint my head with oil. My cup overflows.",My cup is full.
波風が立たないよう 友達のように接する 貴方の態度の事よ,It means that you're still acting like you're everyone's best friend.,"It's about how you treat me like a friend, how you act like a friend."
"""泣きを見る"" 君は言ってくれた",""" It will end in tears. "" You've warned me.","""Look at the tears,"" you said."
この件が蒸し返して 泣きを見なければいいんだが,As long as this doesn't come back and bite us in the ass.,I hope this doesn't come back to make you cry.
分かってるだろう 土下座して 泣きを入れる奴も居れば その一方で 英雄然として,"Well, you know as well as I do, there's guys who roll over and beg and mercy, and then there's those other guys who get all heroic, and are willing to die for the cause.","You know, some people get down on their knees, some people cry, but on the other hand, they act like heroes."
泣きっ面に蜂ですよ,Took us completely by surprise.,It's a bee in my face.
♪別々に暮らす 泣き出しそうな空を,I don't have enough strength anymore,♫ We're gonna be separated We're gonna be crying in the sky
泣くに泣けなかったよ,"It was very, very sad.",I couldn't cry when I was crying.
彼の注意を引いて下さい,Distract him.,You're gonna have to get his attention.
確かに誕生日会はしなかった 周りの注意を引くからな 警察の目も光ってた 目立たない方がいい,"Well, you didn't have birthday parties, because that would draw attention to us and with the police looking for us, that's not a good thing.","You know, I didn't have a birthday party to get people's attention, but the police had a lot of light on me, so I don't want you to look too bright."
念じて物を動かしたり 少しでも父の注意を 引こうとして,"Or that I was moving stuff around with my mind, hoping it might get him to pay a little more attention.","I've been trying to move things, or even try to get my father's attention."
本当にそれは注目に値します 本当に驚異的です CIAにとっては大成功ですね 貴方が作戦統制を管理して以来,"I must say, it is remarkable, really astounding, the success that the CIA has had since you have taken operational control, and so the President has asked me to ask you to ask him, to invite you both","It's really remarkable, really. For the CIA, it's a great success since you handled operational control."
注目に値する,Remarkable.,Remarkable.
科学者で鑑定家としてそう思った こりゃ何だ? 注目に値する,"And as a scientist and a connoisseur, I have I have no idea the contents of this remarkable potion.",That's what I thought as a scientist and appraiser.
"頭は低く, つねに目を見張れ, 注目を浴びたい衝動に打ち克て.","Keep your head down, keep your eyes up, resist the urge to be seen as important or special.","Keep your head down, keep your eyes peeled."
彼らは隊で侵入 メディアと国家からの注目を浴び 人質の命を盾に,"they enter with force, drew the attention of the media and law enforcement using human hostages as collateral for their demands.","They broke in, got a lot of attention from the media and the state, shielded the lives of hostages."
やっとボスの 注目を浴びるチャンスが 来たかと思った,"I saw a chance to step up for you, get noticed.",I thought you might finally have a chance to get your boss's attention.
だが彼は市の裏の部分 残忍さ暴力を浮き彫りにさせる,"What that man does is carry out a dark reckoning for his city. It is a brutal, violent vision of justice, one we do not share.","But he's the underlying parts of the city, the brutality, the violence."
自慢じゃないがこの齢になるまで 一回も浮いた噂はない,I've had no romance in my life.,"I'm not proud of it, but I've never heard of it before."
そう娘を探してる時は いつもこんなよ 娘が消息を絶ってから...,"Yes, he stays out this late when he's looking for my daughter, since my daughter has been gone -- yes!","Yeah, that's what I always do when I'm looking for my daughter, since she disappeared."
レバノン内戦にキリスト教徒側で参戦して その後消息を絶ったが,"Fought with the Christian Phalangists in the Civil War, then disappeared.","He joined the Christian side of the iteration, then disappeared."
教授はラングーンに到着後 消息を絶っています 妻であるアウン・サン・スー・チー氏 を訪ねる目的だった模様,It has not been seen since his arrival in Rangoon where he came to visit his wife.,"The professor disappeared after his arrival in Langoon to pay a visit to his wife, Aung Sanなんだi."
お前の母親はどう? 醜悪な精神病院で 涎を垂らしながら死なせたいかい?,And what about your mother? Huh? You want her to die drooling in some hideous asylum?,"What about your mother, who wants to die in an ugly mental hospital?"
彼女の甘い香水が 俺の涙を誘う,Her perfume a sweet promise that brings tears to my eyes.,Her sweet perfume will draw my tears.
ただ、私の歌はよく子供の涙を誘うがね,"Yeah. On the other hand, my singing would often drive my children to tears.",But my songs often lure children to tears.
どんな時も 涼しい顔してたよね?,How'd you always make it look so easy?,"You always looked so cool, didn't you?"
彼女は涼しい顔で人生を乗り切ってきた,She handled life like it was easy.,She's been through life with a cool face.
竜巻の中に歩いて入り... 涼しい顔で出て来る男,"We need someone who can walk into a tornado, and come out the other side like it was a damn gentle breeze.",A man walks into a tornado... comes out with a cool face.
彼女の血が強く君に訴えてる... それで私は渇きを覚えている。,Her blood appeals to you so much it makes me thirsty.,Her blood is so strong on you... it makes me remember thirsty.
渡りに船さ,"Janitors go anywhere, everywhere, nobody pays any attention to them.",It's a crossing ship.
向こうにとっても 今回の提案は渡りに船だ,This proposal is a godsend to them as well.,"As for the other side, this offer is a cross between ships."
滅相もない... !,Oh no!,It's not a surprise.
私は その場しのぎの 一時的な謙虚さを潔しとしない,"Well, I will not allow false modesty to tarnish the moment.",I will not purge the temporary humility of that place.
Vが濡れ衣を着せたのは二度目,- It's the second time V's framed you... for something you didn't do. - Anything you wanna tell us?,It's the second time the V's have framed you.
まぁ... 教会の金庫を空にする目的で 会計係に濡れ衣を着せ 自分が着服したと考えている,"Well, we think he framed the church accountant for clearing out the church's coffers and took the money for himself.","Well... he thinks he was wearing it to empty the church vault, frame the accountant."
社長に殺人犯の濡れ衣を着せれば 事業計画を妨害できると言うのは わかるけど えらく回りくどいやり方ね,"I get that framing the head of a company for murder could throw a hitch in his business plan, but it's a hell of a long way to go.","Look, I know you think you can sabotage a business plan by framing a killer, but that's a bit of a tricky trick."
濡れ衣を着せられた じゃリストを盗んだ人物は まだ逃走中か,So the person who stole the list is still at large.,So whoever stole the list is still on the run.
あなたを破滅させたがってる人物に 濡れ衣を着せられたように見せかけた,You were being framed by someone who wanted to destroy you.,I tried to look like I was being framed by someone who wanted to destroy you.
濡れ衣を着せられるのはごめんだ,I ain't going down on some trumped-up murder charge.,I don't want to be framed.
任務を与えたら 火に油を注ぐ事に,We have enough race troubles as it is without these sons of bitches in the press throwing fuel on the fire.,"You give me a mission, I'm going to pour oil on the fire."
誰かが気づくべきだった 露骨なまでに目の前にあるんだ perfectly obvious 火を見るより明らか,Any one of us should have seen the perfectly obvious staring us in the face.,"Someone should've seen it, but it's in front of us, clearer than looking at a fire."
チキンはちゃんと火を通して,Make sure those chickens are cleaned properly.,The chicken goes through the fire.
ゆっくり火を通す,-It's all about slow roasting.,Slowly through the fire.
火中の栗を拾う性分,"You never could keep yourself out of trouble, either.",He's the kind of guy who picks up a bunch of wood in a fire.
火中の栗を拾うなら そうなるだろう 奴らは我々をも 普通の人間扱いするだろうか?,Not if we risk our lives doing so.,"If we're gonna pick up a rock in the fire, will they treat us like normal people?"
彼らは海洋で仕事を 火中の栗を拾っている それを了解なしに引き上げようと,"They're out there in the freakin' ocean risking their lives for us, and you raise their taxes without asking me?",They're picking up work in the ocean to bring it up without an understanding.
俺は 5歳か、そこらかな、小さい町で、ワイルドバーグって、 ブラックフォレストにあったんだが、 ちょうど爆撃されて灰燼に帰したんだ、知ってるか?,"I was five years old, or something, in a little town, Wildberg, in the Black Forest, and it was just bombed to ashes, you know?","I was 5 years old and I was in a small town in wildburg, Black Forrest, and just got bombed and sent back to the ashes, you know?"
ダミーコ一味が すべて灰燼に帰すまで―,Not 'til D'Amico and his whole damn operation are burnt to ashes.,Until the D.N.A. team returns it all to the ashes.
"""灸を据える""って言ったろ",But you prayed for me to get punished!,"I said, ""I'm going to put my head on it."""
後ろから弱点を打つ,I must strike the weak spot from behind.,I'll hit the weakness from behind.
点数を稼ぎたいのよ,I need a win.,I'm trying to earn my grades.
古いゲームの所為にしてると マスコミに知れたら,If this gets out to the press that we are pinning this on some old video game...!,"If the press finds out you're blaming me for an old game,"
俺がした事は全て君の為に さようなら,Everything I ever did was for you. All board. All board.,Everything I did for you. Bye.
自分にもっと度量があったら アナタに応えられた アナタの為になる事を,"I just keep wishing that I'd been bigger somehow, able to give you... what you needed to be okay again after you got back, but I couldn't.","If I'd had more of you, I'd have been able to tell you what I'd do for you."
沈黙が君の為に なるとは思えない,I don't believe the life of the Silent Sisters is for you.,I don't think silence is good for you.
お前がしっかりしなきゃ ヤツの為にならないぞ,You oughtta lock him up for his own good.,"If you don't stay strong, it's gonna be bad for him."
当てはないが 為せば成る,Just go for it.,"I don't know what you're talking about, but it's what you're doing."
その烏合の衆の中に 交渉権を持つ者は?,Is there any in this rout with authority to treat with me?,And who among you has the right to negotiate?
烏合の衆のクソ週末兵士に 穴に埋められた,Buried in a hole by a bunch of weekend warriors!,Buried in a hole by a bunch of fucking weekend soldiers from the Cossacks.
烏合の衆のままでは いさかいが絶えぬだけで,"If we work separately, we'll just end up fighting.",I'm not going to be able to keep my mouth shut.
特に 自分の父親を殺した子と 烙印を押されるのはね,Especially when you're branded the kid who killed your dad.,Especially when it's the girl who killed her father.
悪党は全て テロリストの烙印を押され,"This new law, where if you're a bad enough, bad guy they stamp ""Terrorist"" on your jacket.",All the bad guys have been branded as terrorists.
人生の烙印を押されたんだ,I was branded for life.,I've been struck by a mark of my life.
防毒マスクは 水素には 無用の長物になるのです,Gas masks will be useless against hydrogen.,The antidote will be useless to hydrogen.
無辜の民か それが次のターゲットだ,"I-it could be an innocent of some kind, but I think that could be his next kill.",The innocent people. That's the next target.
むやみに無辜の民を殺さないなら,As long as you don't kill the innocent,"If you don't willingly kill innocent people,"
新米の君たちへの忠告だ よく観察して 無駄口を叩くな,"Now, a few words of advice as newbies on the job... eyes open, mouths shut.","I'm warning you all of you, keep an eye out and keep your mouth shut."
じゃ、無駄口を叩くな,Then don't waste time talking about it.,Then don't waste your breath.
考えておるわい 焦点を合わせろ,I said I would think about it. Now focus.,I've been thinking about it. Let's focus.
焦点を合わせるのか。 私は、彼らの正体と、 組織の仕組みを知る価値があると考えました。,"We decided it is worth knowing who these people are and how their organizations operate, because on the other side of the rage and the sadness are clarity and strength, the power we have to focus our efforts effectively,",I thought it was worth knowing who they were and how the organization works.
焦点を合わせて 押すんだ,"You just take it, point it, and shoot it.",Keep your eyes peeled.
これらの一つに焦点を絞りましょう,I want to focus on just one of them.,Let's focus on one of these.
焦点を絞りましょう,Let's narrow the window of incident.,Let's focus.
焼け石に水なんだよ!,- is just a drop in the bucket!,It's water on a burnt stone!
北の我が軍は 煙幕を張り こっそりと、少し後退した 一方、爆撃機は3回にわたり,Our troops in the north put down a smokescreen and under cover they withdrew a little while our bombers went in in three deadly waves to deliver a large aerial bombardment and one of the heaviest of the whole campaign.,"Our troops in the North have set up smoke screens, sneak back a little while, while our bombers have gone off three times."
煮え湯を飲まされた,But to be betrayed by him...,He made me drink boiling water.
銀行さんには 今まで どんだけ煮え湯を飲まされたか,I don't know how many times I've been burned by banks.,How much water did the bank make you drink?
熱が冷めるように,Like the passing of a fever.,That way the heat can get cold.
結婚すると熱が冷めるって おまえ 言ってたけど 俺たち夫婦は 反対だな,"You'd think that marriage would just cool things off, but for us, it's just the opposite.","You said marriage would cool the fever, but we both don't."
彼のことは 完全に熱が冷めたの,That guy is completely out of my system.,I've been completely cold on him.
誰に熱を上げようと 構わんが...,I wouldn't give a shit about your pathetic schoolgirl crush.,I don't care who's making the fever.
熱を上げた最近の 女がすることよ,It's what us modern girls do when we have a crush.,That's what a recent woman with a fever does.
もっと熱を入れて,"Come on, give me some heat...",Put more heat in it.
プレイに熱を入れろ!,Play with some energy now!,Put the heat in the play!
さて最近 この中の誰かが 少し熱くなってます,"Now, one of you has been coming in a little hot lately.","Well, lately, one of these people is getting a little hot."
プライスレスのライフワークです」 って このコメント→ 実に素晴らしくて 胸が熱くなりました!,"To me, surgery is priceless life work."" That comment was so very touching, I was fraught with emotion!","""It's priceless's life's work."""
Who'd have ever thought that this could be? 胸が熱くなるの,Who'd have ever thought that this could be,Who'd have ever thought that this could be?
会場の空気は熱気を帯びて来ています,Enjoy your day.,The air in the ballroom is heating up.
彼女はロマンチックなんだと思う 彼女の好きな詩人の 爪の垢を煎じて飲むわ,"I mean, knowing Jess, she probably just thought it was romantic, following in the footsteps of her favorite poet.","I think she's romantic, drinking the pearls of her favorite poet's nails."
- 車で片を付けるか,I'm gonna keep it about the cars,- I'll take the car and clean it up.
片を付ける ここに居ろ,I got business to finish. You stay here.,I'll clean it up. Stay here.
俺は片を付けようと言ったんだ,I told you we're finishing this.,I told you to clean up.
あの建物が分かるか?,"You recognize building, yes?",Do you recognize that building?
- 探してる物が分かったら教えるよ,It'd help if I knew what the hell I was looking for.,- I'll let you know when I know what you're looking for.
君の所有物を調べれば 君が持ち出した物が分かるかな?,Are they gonna be able to go into your stuff and figure out what you took?,I'm gonna look into your property and see if I can find out what you brought in.
判った 物は試しだ,Okay.,"All right, let's try something."
物は試しと言うだろ,-All right. It was worth a try at least.,I told you to try something.
君がはっきり物を言うから 推薦したのだ,I recommended you to the President because you're not afraid to speak up.,I recommend it because you're clear about something.
お気に召さない? じゃこれだ デカさが物を言う,"Let me tell you something, Size does matter.",You don't like it?
キャロル、相手を 見て物を言えよ,"Carol, you got to start listening to yourself when you talk.","Carol, look who you're dealing with and tell me what's going on."
"ねぇ, この事件は犬も食わないわ.","I mean, this case is a dog.","Hey, this case doesn't eat dogs either."
